"StoreId","CompleteStoreName","FoodType","AverageRating","Reviewers","City","Location"
"hx7f","Rakhang Authentic Thai Kitchen (Kallang/Boon Keng)","",4.3,12,"singapore","Upper Boon Keng Rd 5, 380005 Kallang/Boon Keng, Central, Singapore, Singapore,"
"bav8","Kin Ba Ba (Havelock Road)","Asian",4.9,154,"singapore","737 Havelock Road Singapore 169653,"
"m5uo","Lai Lai Xing Fishball Noodle (Ang Mo Kio Avenue 10)","Noodles",4.4,190,"singapore","555 Ang Mo Kio Avenue 10 #01-1936,"
"quww","Toast Junction (Food Junction - Raffles City)","Coffee",4.6,116,"singapore","252 North Bridge Road #03-15/16/17, Raffles Shopping Centre,"
"ikcc","Chunky Lobsters (2 Havelock Road)","American",4.9,26,"singapore","2 Havelock Road ,059763 , B1-29,"
"n3vx","THAT Thai Place (Beach Road)","Thai",0.0,0,"singapore","Beach Rd 302 #01-02, 199600 Arab Street, Central, Singapore, Singapore,"
"kg4c","Rollin Cheese Dogs (River Valley Road)","Fast Food",0.0,0,"singapore","3B River Valley Road, #01-07, Singapore 179021,"
"t5j5","CJ Fried Chicken (Holland)","Chicken",5.0,85,"singapore","267 Holland Ave,"
"sl6i","Carrotsticks (Robertson Quay)","Western",5.0,46,"singapore","7 Rodyk St #01-34 238216,"
"lwbe","Super Loco (Robertson Quay) - Islandwide","Mexican",4.5,18,"singapore","#01-13, The Quayside, 60 Robertson Quay, River Valley, West Central,"
"oaij","Marusaya (Robertson Quay) - Islandwide","Japanese",0.0,0,"singapore","#01-01, 86 Robertson Quay, Robertson Blue, West Central, River Valley 238245,"
"v3rq","Toby's Estate (Rodky Street)","Western",5.0,370,"singapore","01-03/04, 8 Rodyk Street, River Valley,"
"diax","1 Taste Grill (Ang Mo Kio Avenue 5)","Asian",0.0,0,"singapore","181 Ang Mo Kio Ave 5, Block 181, Singapore 560181,"
"v4td","Havelock Teochew Porridge (717 Havelock Rd)","Chinese",4.9,1388,"singapore","715/717 Havelock Road, Tiong Bahru, West Central,"
"v2pb","Pow Sing Kitchen (Serangoon Gardens Way)","Rice Dishes",4.9,3481,"singapore","59 Serangoon Gardens way, Serangoon, Hougang,"
"y8jw","Gabbar Bistro Bar (Clarke Quay)","",5.0,18,"singapore","3E River Valley Road #01-05/06, Block E Clarke Quay. The Circuit SG179024,"
"v0sp","SENS Dining (Holland Avenue)","Seafood",4.9,278,"singapore","243 Holland Avenue Unit No,"
"c53p","Al Dharsha Indian Cuisine (Beach Road)","Indian",0.0,0,"singapore","6001 Beach Road #01-50, Golden Mile Tower SG199589,"
"y8zp","Salaam Bombay (Robertson Quay)","Indian",3.0,148,"singapore","86 Robertson quay BAR BAR BLACK SHEEP S 238245,"
"xjox","Tapas 24 (Robertson Quay)","Mediterranean",5.0,25,"singapore","60 Robertson Quay, #01-04 Quayside,"
"bjr2","Tomo Tokyo (Clarke Quay)","",0.0,0,"singapore","3A River Valley Rd, #01 - 04,"
"n030","Lau Wang Claypot Delights (Serangoon Central) - Islandwide","Chinese",5.0,25,"singapore","263 Serangoon Central Drive #01-43,"
"u066","Milkfish (Raffles City)","Soups",5.0,265,"singapore","252 North Bridge Road, Raffles City Shopping Centre, B1-44F, S 179103,"
"q2o6","Riverside Canton Claypot Cuisine (NEX)","Chinese",4.3,28,"singapore","23 Serangoon Central #B1-34/35 NEX,"
"w0gy","MOS Burger (Raffles City)","Burgers",5.0,289,"singapore","252 North Bridge Road, #B1-38, Raffles City,"
"szj9","The Skewer Bar (Havelock)","",0.0,0,"singapore","727 Havelock Road, Bukit Merah, 169648,"
"ulon","Klang Bak Kut Teh 江记巴生肉骨茶 (Serangoon Central Drive)","",4.3,18,"singapore","261 Serangoon Central Drive #01-15, S 550261,"
"m5ju","Chan's Wanton Noodle And Fish Soup (262 Serangoon Central Drive)","Chinese",4.2,75,"singapore","Blk 262 Serangoon Central Drive, #01-89, Serangoon, 550262,,"
"lbvp","Kenangan Coffee (Raffles City)","Beverages",5.0,73,"singapore","B1-K10, Raffles City Shopping Centre Singapore, 252 North Bridge Road SG179103,"
"x3vm","Chuang Yi Claypot Delights (Coffee Sense)","Rice Dishes",4.9,425,"singapore","BLK 181 ANG MO KIO AVE 5 #01-2922 S560181,"
"cgbg","Tian Le Fish Soup Ban Mian (204 Serangoon Central)","Asian",4.7,55,"singapore","Blk 204 Serangoon Central,#01-114 Singapore 550204,"
"adl0","MASHI NO MASHI (Guoco Midtown)","Fast Food",4.9,10,"singapore","124 Beach Road, #01-04, Guoco Midtown Singapore, Singapore 189771, S 189771,"
"pjal","Q Lao Korean Style Hotpot (Ang Mo Kio Avenue 5)","Korean",0.0,0,"singapore","181 Ang Mo Kio Ave 5, #01-2922, Singapore 560181,"
"su4v","Ushiyama Yakiniku (Holland Avenue)","Japanese",0.0,0,"singapore","Ushiyama Yakiniku 牛山 焼肉, Holland Ave 251, 278981 Holland Village, Outer Central, Singapore, Singapore,"
"mpfj","Chong Qing Jiang Hu 重庆江湖 (Funan)","Chinese",0.0,0,"singapore","107 North Bridge Rd, #01-19/20, S 179105,"
"ac90","Chuan Seafood Restaurant (Clarke Quay)","Asian",0.0,0,"singapore","Robertson Quay 86 86 robertson quay #01-02 singapore 238245, 238245 Clarke Quay, Central, Singapore, Singapore,"
"u5bc","Jia yang di 家羊地 (Havelock Road)","",4.9,17,"singapore","Havelock Rd 741, 169655 Tiong Bahru, Central, Singapore, Singapore,"
"olb2","Western@jin (Ang Mo Kio)","Western",4.9,13,"singapore","Ang Mo Kio Ave 10 574 #01-1825, 560574 Ang Mo Kio, North, Singapore, Singapore,"
"ho36","正南柒百 Zheng Nan Qi Bai (Excelsior Shopping Centre)","Chinese",5.0,101,"singapore","Excelsior Shopping Centre, Coleman St 5, 01-01A  , 179805 Bugis/City Hall, Central, Singapore, Singapore,"
"y7bq","Go Greek by Zorba (Clarke Quay)","Salads",4.2,72,"singapore","3A River Valley Road, Clarke Quay, #01-02,"
"c4x7","Sumo Salad (Holland Village) - Islandwide","Healthy",5.0,32,"singapore","200 Holland Avenue,"
"nzgi","FAHRENHEIT COFFEE (Beach Road)","Coffee",4.7,13,"singapore","75 BEACH ROAD #01-00 FU YUEN BUILDING S(189689),"
"nja1","Kokoyo Nyonya Delights (Serangoon Central Drive)","Singaporean",4.6,9,"singapore","263 Serangoon Central Dr, #01-43, SG550263,"
"dze9","Yi Pin Xiang Seafood (Coffee Sense) - Islandwide","Chinese",4.7,9,"singapore","#01-2922, Blk 181 Amk Ave 5, Ang Mo Kio, Toa Payoh  560181,"
"fin5","Huang Family Village Mala 黄家村麻辣 (Ang Mo Kio)","Chinese",4.7,16,"singapore","Huang Family Village Mala 黄家村麻辣, Ang Mo Kio Ave 5 181, 560181 Ang Mo Kio, North, Singapore, Singapore,"
"x1yq","Plank Sourdough Pizza (Serangoon Garden Way)","Pizza",4.9,613,"singapore","87 Serangoon Garden Way,"
"nhss","G Sake (Beach Road)","",0.0,0,"singapore","Golden Mile Tower 6001 Beach Road #01-52A/B Singapore 199589,"
"h8ny","Drunken Pot Pavilion 醉香阁 (The Plaza)","Singaporean",4.7,10,"singapore","7500A BEACH ROAD, THE PLAZA, #B1-316,"
"jrrk","Fu Yuan Dining (Clarke Quay)","Asian",0.0,0,"singapore","River Valley Rd 3A, 179020 Clarke Quay, Central, Singapore, Singapore,"
"x4fj","foodpanda test account - Restaurant Delivery","Dessert",0.0,0,"singapore","588D Ang Mo Kio St 52 #01-01, #26-01"
"fpji","S Luck Eating House (262 Serangoon Central)","Chinese",4.9,872,"singapore","#01-97 Serangoon Central, Blk 262, Singapore 550262,"
"bmpx","Tong Luck Bee Hoon & Nasi Lemak (Serangoon Central)","Chicken Wings",4.7,110,"singapore","261 Serangoon Central Dr #01-15 SG550261,,"
"v7nc","Chair Lao Ban 車老板 (134 Casuarina Road)","Chinese",3.0,6,"singapore","134 Casuarina Road, Sembawang Hills Estate, Singapore 579522,"
"s3wh","Le Rida (Mediterranean French And North Indian Cuisine)","Indian",4.9,410,"singapore","903 Bukit Timah Road,"
"s013","Guo Li Xiang (Raffles City Shopping Centre)","Chinese",0.0,0,"singapore","252 North Bridge Rd, #B1-06/07 Raffles City Shopping Centre 179103,"
"rk88","Foodsta Kitchens (267 Holland Avenue)","",0.0,0,"singapore","267 Holland Ave 278989,"
"kdgm","Mamacita Mexican Restaurant (South Beach Avenue) - Islandwide","Ice Cream",0.0,0,"singapore","26 Beach Road, South Beach Avenue #B1-18, Singapore 189768,"
"gg98","Sona's Grill (8 Rodyk)","Indian",0.0,0,"singapore","8 RODYK STREET, #01-01/02,"
"g39h","Riverside Indonesian Grill (Food Junction - NEX)","Grill",5.0,828,"singapore","23 Serangoon Central #04-36/37 Serangoon NEX,"
"x2ez","Chef Recipe (Ang Mo Kio)","Chicken",4.9,917,"singapore","555 ANG MO KIO AVE 10 #01-1936,"
"tgjf","Green Monster Salads (Holland Village)","Salads",5.0,141,"singapore","267 Holland Ave 278989,"
"px5u","Red House Seafood (Clarke Quay)","",0.0,0,"singapore","Red House Seafood Nanyang (Clarke Quay), 179022 Clarke Quay, Central, Singapore, Singapore,"
"ezv1","Fat Mario Pastas (Holland Village) - Islandwide","Pasta",4.9,135,"singapore","267 Holland Ave,"
"vfip","Summer Folks Cafe & Steakhouse (Beach Road)","American",4.9,99,"singapore","124 Beach Road, #01-06 Guoco Midtown, Singapore 189771,"
"rbmq","The Salad Fork (Raffles City)","Salads",4.8,12,"singapore","North Bridge Rd, #B1-44L,"
"ey7n","Numb8ers (Serangoon)","",0.0,0,"singapore","JEM Mala Xiang Guo, Serangoon Central 261, 550261 Serangoon, North, Singapore, Singapore,"
"p6ue","Ka-EN Grill & Sushi Bar (Arcade @ The Capitol Kempinski)","",0.0,0,"singapore","15 Stamford Road, #01-82, Downtown Core, 178906,"
"hjbu","Sushi Zanmai (Holland Village)","Japanese",5.0,64,"singapore","118 Holland Avenue #03-04 278997,"
"s2li","ALT Pizza (Robertson Quay)","Pizza",4.9,1840,"singapore","01-07, 60 Robertson Quay Singapore, Singapore 238252,"
"sqhi","Drinks / Juice / Desserts (Food Junction – Raffles City)","Dim Sum ",4.7,26,"singapore","252 North Bridge Road #03-15/16/17, Raffles Shopping Centre,"
"jf3t","Panuozzo (Capitol Piazza)","Italian",4.9,161,"singapore","13 Stamford Road #B1-32, Capitol Piazza, Singapore 178905,"
"twyq","Bibigo Kitchen (Concorde Shopping Centre)","Korean",5.0,724,"singapore","317 Outram Road, #02-26/27, Concorde Shopping Centre Singapore 169075,"
"o0kl","XW Western Grill (Raffles City Shopping Centre)","Western",3.8,80,"singapore","252 North Bridge Road #B1-44B Raffles City Shopping Centre,"
"hrjd","Jia Bao Bao 呷饱饱 (Serangoon)","Chinese",5.0,16,"singapore","blk 227s, Serangoon Avenue 4, 0219,"
"cepd","Chun Yang Tea (13 Stamford Rd)","Bubble Tea",5.0,49,"singapore","13 Stamford Rd #B2-26 Capitol Piazza Singapore 178905,"
"e7gg","Saladstop! (Havelock)","Salads",5.0,122,"singapore","735 Havelock Road Singapore 169652 #01-01,"
"j7xy","Famous Treasure (City Hall)","",4.1,34,"singapore","13 Stamford Road, Capitol Piazza, #02-28,"
"b3xy","Panini Italiani by Da Paolo (Holland V)","Sandwiches",4.9,172,"singapore","118 HOLLAND AVENUE #01-06,"
"z8vu","Kow Loon Hong Kong Dim Sum 九龙香港点心 (Ang Mo Kio Avenue 5)","Chinese",4.9,843,"singapore","BLK 151 Ang Mo Kio Avenue 5 #01-3030 SINGAPORE 560151,"
"ezew","Sugarkoh (Holland Piazza)","Beverages",5.0,6,"singapore","3 Lorong Liput #B1-08, Holland Piazza, Singapore 277725,"
"o3uk","No Ordinary Chicken (Beo Crescent Market)","Chicken",4.9,10,"singapore","38a beo crescent 01-81 169982,"
"up1r","NamNam (Raffles City) - Islandwide","Vietnamese",4.8,42,"singapore","252 North Bridge Road #B1-46/47, Raffles City Shopping Centre,"
"r44k","$5 Western (5 Upper Boon Keng)","Western",4.9,60,"singapore","5 Upper Boon Keng Road #01-01 380005,"
"a7g3","SMILE DESSERT (Funan)","Dessert",4.9,17,"singapore","107 North Bridge Road Funan Capitaland Mall #02-03,"
"sxhj","Miss Tang's Rice Noodle 唐大小姐小锅米线 (Funan)","Asian",4.1,5,"singapore","107 North Bridge Rd,  Funan, ##02-37, S 179105,"
"zr6i","Catherine's Macarons (62 A Strathmore Ave)","Cakes",3.7,14,"singapore","Block 62 A Strathmore avenue 02-46, Singapore 142062,"
"gj04","Rokus A.G.B. (Serangoon)","Burgers",4.2,9,"singapore","myVillage, Maju Ave 1, B1-23/24, 556679 Serangoon, North, Singapore, Singapore,"
"ffcy","Casuarina Bistro by GoMexico  (Casuarina Road)","Mexican",4.9,88,"singapore","132 Casuarina Road, Sembawang Hills Estate Singapore,"
"x9mx","Flavours by Saute (Funan)","Vegetarian",5.0,585,"singapore","107 North Bridge Rd #B1-30 Funan Mall,"
"x5uo","The Tree Cafe (Funan)","Western",5.0,193,"singapore","107 North Bridge Rd #02-33,"
"slz2","Ya Fu Mini Wok Delights (Food Republic - Suntec City) - Islandwide","Chinese",0.0,0,"singapore","3 Temasek Boulevard #B1-115 to 120 Suntec City Mall,"
"v2eh","Holland Bar L'Operetta (Holland Village)","Pizza",4.8,273,"singapore","23 Lorong Mambong Holland Village Singapore 277682,"
"n9bo","Olivia & Co. (Suntec City)","Coffee",3.8,8,"singapore","3 Temasek Boulevard, Suntec City Mall, tower 1 & 2 Atrium,"
"gues","Omma Korean Charcoal BBQ (Holland)","Korean",4.8,14,"singapore","21, LORONG MAMBONG,"
"ora9","Home Dawn & Dusk (River Valley Rd)","Asian",0.0,0,"singapore","3A River Valley Road #02-03 Singapore 179020,"
"qfbh","Jin Guang Seafood (Ang Mo Kio Avenue 5)","Chinese",4.8,233,"singapore","151 Ang Mo Kio Ave 5, North, Ang Mo Kio,,"
"wafb","Kiwami (Suntec City)","Japanese",5.0,60,"singapore","3 Temasek Boulevard, #02-458, Suntec City Mall, Singapore 038983,"
"x5dr","d.o.c (South Beach Avenue)","Pizza",4.8,104,"singapore","26 Beach Road, South Beach Avenue #B1-22, Singapore 189768,"
"reul","Tiong Bahru Bakery (Raffles City) - Islandwide","Bakery",5.0,111,"singapore","252 North Bridge Road, #B1-11 Raffles City Shopping Centre,"
"jw6w","Butter Bowl (Temasek)","American",5.0,7,"singapore","3 Temasek Blvd, #01 - 645 / 646,"
"x2jg","Julia BBQ (Serangoon Garden Market & Food Centre)","Seafood",4.1,775,"singapore","49 Serangoon Garden Way, #01-23,"
"s6yh","Inle Myanmar (North Bridge Road)","Asian",4.9,164,"singapore","111 North Bridge Road, #B1-07 A/B,"
"wuii","88 Sze Chuan (Holland Village)","Seafood",0.0,0,"singapore","24A Lorong Mambong SG277683,"
"oi97","British Indian Curry Hut (Lorong Mambong) - Islandwide","Indian",0.0,0,"singapore","30 Lorong Mambong,"
"v2pn","Pepper Castle (Holland Village)","Indian",5.0,1372,"singapore","33 Lorong Liput, Bukit Timah/Buona Vista,"
"ujhx","Chops & Sear (Ang Mo Kio Avenue 10)","",4.9,214,"singapore","Blk 529 Ang Mo Kio Ave 10 #01-2337 SG560529 (Detian Coffeeshop),"
"xi62","AFURI (Funan Mall) - Islandwide","Ramen",0.0,0,"singapore","107 North Bridge Road #B1-29 Funan Mall,"
"lxok","Tai Cheong Bakery (Holland Village)","Chinese",5.0,227,"singapore","31 Lorong Liput SG277742,"
"x9oz","Tango Restaurant (Lorong Mambong)","Pasta",4.8,96,"singapore","35 Lorong Mambong,"
"v3ao","Chuan Yang Ji (Geylang)","Chinese",5.0,123,"singapore","2 Lor 1 Geylang, Paya Lebar, Paya Lebar/Macpherson,"
"v5vb","Cha Cha Cha Mexican Restaurant (Lorong Mambong)","Mexican",4.9,470,"singapore","32 Lorong Mambong, Holland Village, Bukit Timah,"
"iwo4","Tawa and Tandoor (Lorong Liput)","Indian",4.9,171,"singapore","33 Lorong Liput, Bukit Timah/Buona Vista,"
"aq92","Wingsplus (Holland Piazza)","Western",4.9,95,"singapore","3 Lor Liput, B1-07, Holland Piazza, S 277725,"
"v4sg","Chong Qing Grilled Fish (Serangoon)","Chinese",4.9,2064,"singapore","2 Maju Avenue,"
"zrk2","Lola's Cafe (Lor Mambong)","Western",4.9,15,"singapore","48 Lor Mambong #01-00,"
"x4dx","Nasty Cookie (Funan Mall)","Dessert",5.0,292,"singapore","107 North Bridge Road, Funan #02-35,"
"s561","Grandma's Pig Trotter Rice (Serangoon Garden Chong Qing Grilled Fish)","Chinese",4.8,131,"singapore","2 Maju Avenue 556680,"
"dziw","Jyu Lae Restaurant 聚樂 (Suntec City Convention Tower)","Asian",0.0,0,"singapore","3 Temasek Boulevard, #01-315/316 Suntec City Convention Tower 038983,"
"bafi","Chang An BBQ (Lorong Liput)","",4.8,38,"singapore","19 Lorong Liput, Singapore 277732,"
"gvzh","Hanjip Korean Grill House (River Valley)","Soups",4.2,75,"singapore","3C River Valley Road #01-11 The Cannery Singapore 179022,"
"ogln","Pergola (Swiss Club)","Indian",4.9,22,"singapore","36 Swiss Club Road, SG 288139,"
"t488","Tempura Makino (Suntec City Mall)","Japanese",0.0,0,"singapore","3 Temasek Boulevard #02-305/308/311 Suntec City Mall, Singapore 038983,"
"y2nc","555 Ang Mo Kio Cai Fan 555 宏茂桥菜饭 (Ang Mo Kio Avenue 10)","Singaporean",4.6,241,"singapore","Blk 529 Ang Mo Kio Ave 10 #01-2337 Singapore 560529,"
"ebxm","Ajumma's Funan (Funan Digitalife Mall) - Islandwide","Korean",4.8,20,"singapore","107 North Bridge Road, #B1-31, Funan Digitalife Mall, Singapore,"
"bxv3","Seed & Co. (Holland Piazza) - Islandwide","Healthy",5.0,16,"singapore","3 Lor Liput Holland Piazza Unit No: B1-16 Postal Code: 277725,"
"s8nz","La Nonna (Holland Village)","Pizza",4.9,836,"singapore","26/26B Lorong Mambong,"
"lbfd","Imam Banana Leaf Restaurant (Bedok)","",0.0,0,"singapore","Lor 1 Geylang 10, 389119 Bedok, East, Singapore, Singapore,"
"nlcy","HanGrut (Concorde Shopping Centre)","Korean",4.8,33,"singapore","317 Outram Road, #02-27 Concorde Shopping Centre,"
"ycqz","Milan Romana (Funan Mall)","Japanese",0.0,0,"singapore","107 North Bridge Road #B1-29 Funan Mall 179105,"
"hlng","Chong Pang Hainanese Chicken (505 Ang Mo Kio)","Asian",0.0,0,"singapore","Blk 505 Ang Mo Kio Ave 8 #01-2688 Singapore 560505,"
"v0no","iSTEAKS (MyVillage)","Western",4.8,4310,"singapore","#02-03, 1 Maju Avenue, My Village, Serangoon Garden, Hougang,"
"wtyb","Xiang Qin 湘琴 荷兰村 (31 Holland Close)","Mala Xiang Guo",4.2,64,"singapore","31 Holland close #01-241 270031,"
"anp9","Now Pizza (Funan)","American",5.0,297,"singapore","B2 31,Funan Mall,107 North Bridge Rd, Singapore 179105,"
"qtas","Kageyama (Temasek Boulevard)","Japanese",0.0,0,"singapore","3 Temasek Boulevard, #02-605 038983,"
"t3qg","CHUN CHUN TIAN MI DESSERTS (Serangoon Garden Way)","Dessert",5.0,35,"singapore","Serangoon Garden Way 66a, 555962 Serangoon, North, Singapore, Singapore,"
"y7rj","Tat Lee Seafood (204 Serangoon Central)","Seafood",4.9,496,"singapore","204 Serangoon Central, Block 204,"
"d9cz","Umi Nami (Lorong Mambong)","Japanese",5.0,49,"singapore","8 Lorong Mambong, Singapore 277674,"
"s220","Fuyuan (Performance Building)","Asian",0.0,0,"singapore","158 KALLANG WAY #01-02 PERFORMANCE BUILDING SINGAPORE 349245,"
"us2s","Banh Mi Saigon (Ang Mo Kio Avenue 8)","Vietnamese",5.0,175,"singapore","505 Ang Mo Kio Ave 8, #01-2668 Singapore 560505,"
"tw5q","87 Just Thai (Holland Village)","Thai",4.9,145,"singapore","34B Loong Mambong, Singapore 277691,"
"q5vo","Don King By Beans Party (Holla Holland)","Rice Dishes",4.6,69,"singapore","33 Lorong Liput, Stall 1, S 277744,"
"ypzx","Mandalay Restaurant (Peninsula Plaza)","Vietnamese",4.9,181,"singapore","111 North Bridge Road #B1-01 Peninsula Plaza, S 179098,"
"tzf9","Grand Konak Restaurant (Clarke Quay) -  Restaurant Delivery","",0.0,0,"singapore","3D River Valley Road #01-05, Clarke Quay SG179023, S 179023,"
"cqve","Uncle Fong Hotpot Restaurant (Suntec City)","Chinese",0.0,0,"singapore","3 Temasek Boulevard, Suntec City #02-391, Atrium (Convention Centre),"
"rd5o","Cui Cui Xiang Popiah & Rojak (MacPherson)","Singaporean",4.7,12,"singapore","Upper Aljunied Ln 1, 360001 MacPherson, East, Singapore, Singapore,"
"y4cv","Haidilao Hot Pot (Clarke Quay) 海底捞火锅 - Restaurant Delivery","Chinese",4.8,49,"singapore","3D RIVER VALLEY ROAD #02-04/01, CLARKE QUAY,"
"x4fw","Potato Corner (Funan)","Fries",4.9,253,"singapore","107 North Bridge Road #B2-K13 Funan Mall,"
"t3hq","Osaka Ohsho (Raffles City)","Japanese",4.9,247,"singapore","252 North Bridge Rd, #B1-75, Raffles City, Singapore, 179103,"
"x9cw","Siang Hee Seafood ( Serangoon Garden Market & Food Centre)","Chinese",4.9,191,"singapore","#01-20 Serangoon Garden Market & Food Centre, 49A Serangoon Garden Way,"
"x0jq","Tandoori Kebabs & Curries (Ayer Rajah Crescent)","Indian",4.8,46,"singapore","01-02 , 33 Lor liput 277744,"
"awzh","Cafe Usagi (Suntec City)","Singaporean",0.0,0,"singapore","3 TEMASEK BOULEVARD #02-615A SUNTEC CITY MALL Suntec Tower 4,"
"y8wu","Tokyo Sundubu (Raffles City)","Japanese",4.9,60,"singapore","252 North Bridge Road, B1-16 Raffles City Singapore 179103,"
"qmwv","Hainan Scissors Curry Rice (Ang Mo Kio Avenue 10)","",4.9,62,"singapore","527 Ang Mo Kio Ave 10, North, Ang Mo Kio, #01-119,"
"qifr","Incredi Bowl (Serangoon Road)","Dessert",5.0,91,"singapore","3A River Valley Road, Block A #01-07 Clake Quay, Singapore 179020,"
"s0ho","Hooters Singapore (Clarke Quay)","Western",4.7,218,"singapore","01-03 Blk 3D River Valley Road, Clarke Quay Lower Central,"
"bbx4","RASOI -THE INDIAN KITCHEN (Lorong Liput) - Islandwide","Indian",4.8,6,"singapore","33 Lorong Liput, Bukit Timah/Buona Vista,"
"wq2z","CURRY HUT EXPRESS (Holland V) - Islandwide","Indian",0.0,0,"singapore","30 Lorong Mambong,"
"v1zb","Thaiexpress (Raffles City)","Thai",4.8,596,"singapore","#B1-77, 252 North Bridge Road The Raffles Market Place, Lower Central, Bugis, City Hall,"
"kz8m","Rasa Sindo (Dawson Road)","Malaysian",4.9,591,"singapore","Blk 85 Dawson Road #01-02 Skyville@Dawson Singapore 141085,"
"oyld","Jia Li Seafood Soup (Lor Liput)","Seafood",4.8,281,"singapore","33 Lor Liput,"
"o3ry","Wafu Japanese Cuisine (Food Republic - Suntec City)","Rice Dishes",5.0,11,"singapore","3 Temasek Boulevard #B1-115 to 120 Suntec City Mall,"
"y5yk","Lady M (South Beach)","Dessert",5.0,96,"singapore","26 Beach Rd, 01-17,"
"v5it","Wala Wala Cafe Bar (Lorong Mambong)","Pizza",5.0,201,"singapore","31 Lorong Mambong,"
"voe4","Chops! Grill & Sides (Kallang)","Western",4.9,215,"singapore","8 Jalan Ayer #01-02 Studio8 389144,"
"k6kq","33 Zhi Char (Lorong Liput)","Chinese",5.0,177,"singapore","33 Lorong Liput, Singapore, 277744,"
"vbzc","Bella Italia Pizzeria Ristorante (myVillage Serangoon Garden)","Pizza",4.9,64,"singapore","1 Maju Ave #02-12/13, myVillage,"
"xso0","Goba! 果霸茶 (Raffles City)","Beverages",0.0,0,"singapore","252 North Bridge Road #B1-69 Singapore 179103,"
"s1zm","Baden Restaurant & Pub  (Lorong Mambong)","Singaporean",4.5,97,"singapore","42,Lorong Mambong, Holland Village, Bukit Timah, Buona Vista,"
"awb7","Maze Soba Hototogisu (Funan)","Japanese",0.0,0,"singapore","107 North Bridge Road, #01-11 (Funan) 179105,"
"x8hx","Heng Heng Seafood (Havelock Road)","Noodles",4.9,103,"singapore","Blk 22 Havelock Road, #01-669,"
"v9qi","Tim Ho Wan (Citylink)","Dim Sum ",5.0,673,"singapore","B1-63/63A, 1 Raffles Link, Citylink Mall, Promenade, Lower Central, Central,"
"g78c","Fu Hua Coffee (Tiong Bahru)","Beverages",0.0,0,"singapore","Beo Cres 38A, 169982 Tiong Bahru, Central, Singapore, Singapore,"
"vosi","PPP Coffee (Funan Mall)","Coffee",4.8,108,"singapore","107 North Bridge Road, #02-19, Funan Mall,"
"cy75","Sanchos (Clarke Quay)","Mexican",0.0,0,"singapore","3D River Valley Rd, #01-07 Block D 179023,"
"q9ov","204 Braised Duck (Serangoon Central)","Malaysian",4.9,275,"singapore","204 Serangoon Central #01-104, S 550204,"
"v1yi","Tea Co (Ang Mo Kio Avenue 8)","",4.9,371,"singapore","505 ANG MO KIO AVE 8 01-2676,"
"x1br","The Oyster Bank (Funan Mall)","Rice Dishes",4.7,26,"singapore","The Oyster Bank - Funan Mall 107 North Bridge Road Unit No: #02-32,"
"h86u","Leek Hainanese Chicken Rice (Beo Crescent Market)","Chicken",0.0,0,"singapore","169982, 169982 Tiong Bahru, Central, Singapore, Singapore,"
"e8v2","Hot & Cold Desserts 顺兴清甜五味汤 (Margaret Drive)","Dessert",5.0,198,"singapore","38A Margaret Dr #02-24, S 142038,"
"s2wl","RK Eating House (Kensington Park Road)","Indian",4.9,5703,"singapore","1 Kensington Park Rd, Serangoon Garden,"
"c52o","sen-ryo (Suntec City)","Japanese",4.8,9,"singapore","3 Temasek Boulevard, #01-434 Suntec City,"
"y6uk","Dinghao Sugarcane Juice (Chomp Chomp Food Centre)","Beverages",5.0,406,"singapore","20 Kensington Park Rd, Chomp Chomp Food Centre Stall 21, S 557269,"
"hgxu","Bakery 1946 (Suntec City Tower 3)","Korean",4.9,120,"singapore","3 Temasek Boulevard #01-604, Suntec City, Singapore 038983,"
"uymb","Artistic Grounds (MacPherson)","Western",0.0,0,"singapore","Kallang Pudding Rd 66, 349324 MacPherson, East, Singapore, Singapore,"
"mks1","Sourbombe Artisanal Bakery (Holland Village)","Singaporean",5.0,53,"singapore","7 Holland Village Way #01-27 One Holland Village  Singapore, S 275748,"
"v6uy","Goldleaf Restaurant (Geylang)","Chinese",4.5,132,"singapore","83 Geylang Road Singapore 389200,"
"pgxd","Wings Bar & Grill (Merchant Road)","American",0.0,0,"singapore","30 Merchant Road #01-04 Riverside Point SG058282, S 58282,"
"y3fx","Tendon Kohaku The Central (Clarke Quay Central)","Japanese",4.9,153,"singapore","6 Eu Tong Sen Street, The Central, #B1-53 Singapore, Singapore 059817,"
"s8be","Char Grill Bar (Holland Village)","Western",5.0,2437,"singapore","25A Lorong Liput, Holland Village, Bukit Timah, Buona Vista,"
"a4xx","Fried Chicken Master (Suntec City)","Asian",4.9,21,"singapore","3 Temasek Boulevard, Mall, #02-601 Suntec City, Singapore 038983, S 38983,"
"s0rj","Ming Fa Fishball (Amk)","Noodles",4.9,4394,"singapore","529 Ang Mo Kio Avenue 10, #01-2361,"
"y1ba","Man Dang Dang BBQ 满当当原碳烧烤 (Geylang Road)","Chinese",5.0,169,"singapore","91 Geylang Road,"
"z39z","Ben's Cookies (Suntec City)","Bakery",5.0,16,"singapore","5 Temasek Blvd, B1-K11, Singapore 038985,"
"x9ur","White Restaurant (Suntec City)","Noodles",5.0,757,"singapore","3 Temasek Boulevard, Suntec City, Fountain Court, #B1-131,"
"h77b","Twelve Hainanese Chicken Rice (Jalan Kukoh Food Centre)","",4.6,17,"singapore","1 Jalan Kukoh #01-04, Jalan Kukoh Food Centre, Singapore 161001,"
"zimu","Kazutake Ramen (530 Ang Mo Kio )","Japanese",4.9,199,"singapore","530 Ang Mo Kio Ave 10, #01-2381, Singapore 560530,"
"boj3","The Upper House Grill & Bar (Funan)","Western",0.0,0,"singapore","107 North Bridge Road,#07-38 & 39, Funan, Singapore 179105,"
"w9q9","Wushiland Boba (Holland Vlg)","Beverages",4.9,62,"singapore","7 Holland Village Way, #02-22, S275748,"
"vuj5","KATSU-AN (Suntec City)","Japanese",4.9,326,"singapore","3 Temasek Blvd, #B1-149A Tower 2, Suntec City 038983,"
"t261","Rong Cheng Rou Gu Cha (Ang Mo Kio)","Soups",4.9,366,"singapore","505 Ang Mo Kio,"
"eszn","Big Fish Small Fish - Fish & Chips, Pasta and More (Suntec City Mall) - Islandwide","Western",0.0,0,"singapore","3 TEMASEK BOULEVARD #02-606/607 SUNTEC CITY MALL SINGAPORE 038983,"
"mz7g","Bukchon Korean Restaurant (Macpherson Mall)","Chinese",4.8,41,"singapore","401 MacPherson Rd, #01-07&06, Singapore 368125,"
"m4x2","Hup Lee Fried Bee Hoon (Aljunied) - Islandwide","Noodles",0.0,0,"singapore","City: Singapore
District: East
Area: MacPherson
Blk 1 Upper Aljunied Lane #01-02, S360001,"
