"StoreId","CompleteStoreName","FoodType","AverageRating","Reviewers","City","Location"
"b6nl","Choo Chiang Roast Noodle House (Yishun Avenue 5)","Chinese",5.0,1012,"singapore","Blk101, yishun Ave 5 #01-101,"
"u95l","The Pasta Shop (Yishun Ring Road) - Home-Based Vendor","Western",0.0,0,"singapore","107 Yishun Ring Road, #05-255 S760107,"
"jmuu","Wak Min Food & Catering (Junction Nine)","",5.0,2711,"singapore","18 Yishun Avenue 9 #02-05, Yishun Junction 9 (768897),"
"rgiz","Malay Cuisine (Tampines)","Malaysian",0.0,0,"singapore","Temasek Polytechnic, Tampines Ave 1 21 Blk 25 Level 2, 529757 Tampines, East, Singapore, Singapore,"
"n0k2","兴隆 Pig Organ Soup & Kway Chap (Punggol Field)","Soups",4.9,977,"singapore","Stall No: 03 Kopitiam 108 Punggol Field, #01-01 820108,"
"f7gi","Xiang Rui Gourmet (Yishun) - Islandwide","Porridge",4.9,17,"singapore","105 Yishun Ring Road #01-134 Chong Pang Market & Food Centre, Singapore 760105,"
"hqko","Xie Bi An Vegetarian (Tampines)","Vegetarian",5.0,66,"singapore","824 Tampines St.81 #01-38 BK Coffeeshop Singapore 520849,"
"lixh","Sheik Allauddin Briyani & Indian Muslim Food (Bedok)","Indian",4.7,13,"singapore","216 BEDOK NORTH STREET 1 #01-12 SG460216,"
"x2gd","Yvonne Vegetarian Pancake (Blk 253 Choa Chu Kang Market & Food Centre)","Vegetarian",5.0,208,"singapore","253 Choa Chu Kang Ave 2 #01-05,"
"g1os","Wu Ah Ge Lao Huo Tang (Punggol Field)","Soups",4.8,747,"singapore","108 Punggol Field, 01-01,"
"nvbk","Huat Seafood Restaurant (Yishun St)","Asian",0.0,0,"singapore","333C Yishun St 31 #01-173, S 763333,"
"yeqb","Wow Wow Wok (Junction Nine)","Asian",5.0,25,"singapore","768897,  18 Yishun Avenue 9 #02-05 Junction 9 Mall, 768897 Yishun, North, Singapore, Singapore,"
"sfn7","AL HAYAT RESTAURANT (Yishun) - Islandwide","Indian",4.9,14,"singapore","NO 18, YISHUN AVE 9, #01-77,"
"s7pd","Ice Talk Xpress (Punggol)","Bubble Tea",5.0,2844,"singapore","02-07B, 168 Punggol Field, Sengkang Punggol,"
"s7op","San Gloo (Junction Nine)","Dessert",4.9,1259,"singapore","#02-41, 18 Yishun Ave 9, Junction Nine Opposite Sheng Shiong,"
"ppps","J Grills (Yishun)","Western",4.2,25,"singapore","Junction Nine, #02-05, Yishun Ave 9 18, 768897 Yishun, North, Singapore, Singapore,"
"trb3","Long John Silver's (Heartbeat@Bedok) - Islandwide","Singaporean",0.0,0,"singapore","11, Bedok North Street 1, #01-13 Heartbeat@Bedok,"
"d1pz","Hk Hennessy Roast Duck (198 Punggol Field)","Singaporean",4.9,759,"singapore","198 Punggol Field #01-01 820198, S 820198,"
"y1rh","Master Crab Seafood Restaurant (Punggol Field)","Chinese",4.8,350,"singapore","Blk 108, #01-01, Punggol Field,"
"ows9","Confirm + Chop Western Grill (Punggol Field)","",5.0,9,"singapore","108 Punggol Field #01-01, (Stall 8), Singapore 820108, S 820108,"
"f9rs","Da Yan Herbal Soup & Claypot Rice (Koufu Punggol Plaza)","Chicken",4.9,1195,"singapore","Blk 168 Punggol Field, #01-01, Stall 4, Punggol, 820168,"
"ghe0","Lady Boss Seafood (Yishun Ave 5)","Chinese",5.0,195,"singapore","101 Yishun Ave 5, #01-93, Yishun, 760101,"
"s6uz","Cheng Gong (Blk 253 Choa Chu Kang Market & Food Centre)","Chinese",4.9,3950,"singapore","Blk 253 Choa Chu Kang Ave 1 #01-17,"
"y8xb","Ding Xiang Mala Xiang Guo (Bedok)","Chinese",5.0,716,"singapore","Blk 217, Bedok North Street, unit #01-77  Singapore, Singapore 465423,"
"ti0q","Pasta Play (Waterway Point)","Italian",4.7,101,"singapore","83 Punggol Central, Waterwaypoint, B1-K8,"
"ntiv","Bao Appetit (New Upper Changi Road)","Chinese",0.0,0,"singapore","New Upper Changi Rd 211 #01-763, 460211 Bedok, East, Singapore, Singapore,"
"hba8","Xiao Rui Mala Hotpot 小蕊麻辣香锅 (Choa Chu Kang)","Chinese",0.0,0,"singapore","802B Keat Hong Close #08-79, S 682802,"
"psk8","Old World Bkt & Fried Porridge Yishun @ Old Hokkien (Yishun Avenue 5)","Asian",4.9,52,"singapore","101 Yishun Avenue 5 #01-55 Singapore 760101,"
"hxm4","Ah Li Ipoh Hor Fun Fish Dumpling (01-37, Blk 216 Bedok Food Centre And Market)","Chinese",5.0,532,"singapore","Blk 216 Bedok Food Centre and Market, 216, Bedok North Street 1, East, Bedok, 01-37,"
"zk2r","Makan Empire (Woodlands)","Malaysian",5.0,17,"singapore","17 Woodlands Drive 17 #B2-05/06 SG737628,"
"ljtp","Simply Hainanese Chicken Rice (Yishun Street 11)","Asian",4.7,5,"singapore","156 Yishun Street 11,"
"wyid","Ceylonese Crabs - Authentic Sri Lankan Food (East Coast Park) - Islandwide","",5.0,127,"singapore","1202 East Coast Parkway #01-02, East Coast Park (East Coast Seafood Centre - near carpark E1), Singapore 449881,"
"g1ay","Jidelai Hainanese Chicken Rice (105 Yishun)","Chicken Rice",4.0,38,"singapore","105 Yishun Ring Road #01-152 Chong Pang Market & Food Centre, Singapore, 760105,"
"bp3e","NEW HAWA (Junction 9)","Chinese",5.0,465,"singapore","Junction 9 #01-37, 18 Yishun Avenue 9 SG768897,"
"skhv","Dua Tao Lu Wei (Jurong East)","Chinese",0.0,0,"singapore","BLock 301 Jurong East Street 32, #07-58, 600301,"
"iz2f","Jo's Cha茶救星球 (Yishun Avenue 9 )","",5.0,63,"singapore","Yishun Ave 9 18 Junction 9, Unit 01-39, 768897 Yishun, North, Singapore, Singapore,"
"toek","Tan's Noodle (Punggol)","Chinese",4.9,24,"singapore","Punggol Walk 308C, 823308 Punggol, North, Singapore, Singapore,"
"m745","1 Claypot Delights, 1煲团圆饭 (Yishun Street 11)","Chinese",4.8,8,"singapore","Yishun Street 11 156, 760156 Yishun, North, Singapore, Singapore,"
"q6h2","Prince of Curry 咖喱小王子 (Tampines)","Asian",0.0,0,"singapore","Tampines Industrial Dr 7, 528547 Tampines, East, Singapore, Singapore,"
"tajh","Ba Guo Grilled Fish 巴国烤鱼 (Junction Nine)","Chinese",4.8,34,"singapore","18 Yishun Ave 9, North, Yishun, Junction Nine #01-33,"
"y3xu","百年 Bai Nian (Yishun)","Asian",5.0,1538,"singapore","105 Yishun Ring Road 01-168,"
"nfo2","BingXue Tea & Ice Cream (Junction Nine)","Beverages",0.0,0,"singapore","18 Yishun Ave 9, #02-59 Junction Nine (outside ShengSiong), Singapore 768897,"
"s4tr","Chat Masala (Upper East Coast Road)","Indian",4.8,1283,"singapore","158 Upper East Coast Road,"
"r9z9","noowegian sushi (Punggol Plaza)","Singaporean",0.0,0,"singapore","168 PUNGGOL FIELD #01-K3, PUNGGOL PLAZA,"
"ngfm","Take-Out Salad (Junction Nine)","Salads",5.0,1092,"singapore","18 Yishun Ave 9, JUNCTION NINE Unit No: 02-62 768897,"
"e0mx","Duck King (Koufu Punggol Plaza)","Chinese",4.9,355,"singapore","168 Punggol Field #01-01 Stall 10,"
"xult","Nummun Thai Kitchen (Chong Pang)","Thai",5.0,103,"singapore","Blk 103 Yishun Ring Road #01-85 760103,"
"zbuf","Healthy Soup (Junction Nine)","Chinese",0.0,0,"singapore","18 Yishun Avenue 9, #02-05 Junction Nine, Ban Mian Stall s768897, S 768897,"
"uw3f","Global Wanton Mee (Keat Hong Shopping Centre)","Asian",0.0,0,"singapore","253 CHOA CHU KANG AVENUE 1, #01-24, Stall 8, KEAT HONG SHOPPING CENTRE,"
"cs8p","Ming Dynasty Roast Duck (Punggol)","Asian",4.9,20,"singapore","308C Punggol Walk #01-308 Waterway Terraces 1 S823308,"
"znlw","Yong Le Fish Soup Porridge (Yishun Street 31)","Asian",4.8,54,"singapore","333C Yishun Street 31 #01-173,"
"hxms","Cha Mulan (Bedok Food Centre and Market)","Beverages",0.0,0,"singapore","Blk 216 Bedok Food Centre and Market, Bedok North Street 1 216, 460216 Bedok, East, Singapore, Singapore,"
"no0c","Old Airport Wanton Noodle (Woodlands Health Campus)","Chinese",0.0,0,"singapore","17 Woodlands Drive 17 #B1-03/04 Stall 12, S 737628,"
"djef","Mama Don (Yishun) - Islandwide","Rice Dishes",4.9,5,"singapore","Mama Don Craze Kitchen, 18 Yishun Ave 9 Junction Nine, #01-02 S768897,"
"i6xo","Eggsmith (Waterway Point)","Burgers",4.8,10,"singapore","83 Punggol Central, #01-17 Waterway Point West Wing 828761,"
"qkpy","Tori X (824 Tampines St 81)","Japanese",4.9,94,"singapore","520824,  Blk 824 Tampines Street 81 #01-22, 520824 Tampines, East, Singapore, Singapore,"
"v67x","Mutiara Laut Seafood Restaurant (Punggol)","Seafood",4.9,69,"singapore","Mutiara Laut Seafood, Punggol Walk 308, 823308 Punggol, North, Singapore, Singapore,"
"gknr","Mala Ma (Junction Nine)","",0.0,0,"singapore","Junction Nine, 18 Yishun Avenue 9 #02-05 (Wak Min Foodcourt) SG768897,"
"evrw","Good OL' Dessert (Yishun Avenue 9)","Dessert",4.9,13,"singapore","18 YISHUN AVENUE 9 #02-58 JUNCTION NINE SINGAPORE,"
"w9tz","Shi Man Lou Vegetarian (Punggol Plaza)","Vegetarian",3.7,217,"singapore","01-01, 168 Punggol Field, Punggol Plaza, Punggol, Sengkang,"
"qg87","Makan Or Tapao (Muslim Owned) (Tengah Drive) - Islandwide","",0.0,0,"singapore","Blk 120C Tengah Drive, #07-55, Singapore 693120,"
"ywpm","Quan Ji Teochew Noodle (Koufu Punggol)","Asian",4.8,459,"singapore","168 Punggol Field #01-01 Punggol Plaza,"
"l7qe","An Nurul Indian Muslim Food (Bukit Panjang)","Indian",0.0,0,"singapore","680253,  253 Choa Chu Kang Ave 1 #01-24, Singapore 680253, 680253 Bukit Panjang, West, Singapore, Singapore,"
"cpe6","JAPANESE & KOREAN FOOD (Punggol Plaza)","Asian",4.9,162,"singapore","168 PUNGGOL FIELD #01-01 PUNGGOL PLAZA,"
"ru6y","SAN YE SEAFOOD ZICHAR 三爷海鲜煮炒 @ TAMPINES","Chinese",4.9,763,"singapore","824 Tampines Street 81 , 01-38 ,520824 Tampines, East, Singapore, Singapore,"
"fy2e","Bubblekia (Tampines)","Tea",5.0,35,"singapore","825 Tampines Street 81, #01-46, Singapore 520825,"
"t80n","ISHIRO FUSION BOWL (Junction 9)","",5.0,780,"singapore","18 Yishun Ave 9, Junction 9 #02-38,"
"vm3i","Kinara (East Coast) - Islandwide","Indian",4.2,18,"singapore","164 Upper East Coast Road,"
"b8xs","Zhen Neng Zhu Ban Mian & Fish Soup (Koufu Punggol Plaza)","Chinese",4.8,1020,"singapore","168 Punggol Field #01-01 Stall 6,"
"v6hq","Diamond Kitchen (Marine Parade)","Chinese",4.7,516,"singapore","#01-22/23, 5000F Marine Parade Road, Laguna Park Condominium, Upper East Coast, East Coast,"
"zlbm","Ipoh Zai Hakka Noodle (216 Bedok Food Centre and Market)","Chinese",0.0,0,"singapore","216 Bedok North Street 1, #01-45, Singapore 460216, S 460216,"
"hlgy","Tai Shen Kitchen (Keat Hong Close)","",0.0,0,"singapore","Keat Hong Cl 805b, 682805 Bukit Panjang, West, Singapore, Singapore,"
"ai69","So Lemak (Bedok North)","Chicken Wings",5.0,79,"singapore","217 Bedok North Street 1 #01-77 SG460217,"
"uvud","Tian Tian Cooked Foods (Chong Pang Market & Food Centre)","Chinese",4.7,18,"singapore","105 Yishun Ring Rd, #01-153, Singapore 760105,"
"hvks","Eastern Wok (Junction Nine)","Chinese",5.0,188,"singapore","18 Yishun Avenue 9 #02-42 Junction Nine,"
"b3ib","Jade's chicken (New Upper Changi Rd)","Asian",4.9,22,"singapore","New Upper Changi Rd 211,01-763,  460211 Bedok, East, Singapore, Singapore,"
"qq74","Da Qiu Seafood Kitchen (Yishun Street 31) - Islandwide","",0.0,0,"singapore","333C Yishun Street 31 #01-173 S763333,"
"w6qk","Na Na Homemade Curry (Jurong East)","Curry",5.0,420,"singapore","Blk 303, Street 32, Jurong East, Clementi,"
"adw1","Chef Kiss Madame (Ang Mo Kio Ave 3 )","American",3.7,5,"singapore","131 YISHUN STREET 11, #09-241, 760131 Singapore,"
"y5pu","Woong Kee Ipoh Traditional Claypot Chicken Rice (Punggol)","Malaysian",4.8,1063,"singapore","Blk 308C punggol walk #01-308 waterway terrance 1 S823308,"
"t43u","Ichidon Winkitchen (Yishun Street 31)","Rice Dishes",5.0,398,"singapore","333c Yishun Street 31, North, Yishun, Stall 2,"
"h6mh","One Two Eat Food Court (Heartbeat @ Bedok)","Singaporean",0.0,0,"singapore","11 Bedok North Street 1 #01-28/29 Heartbeat @Bedok Singapore 469662,"
"sph5","Enaq The Prata Shop (Jurong East Street)","Indian",5.0,1074,"singapore","303 Jurong East Street 32, #01-96,"
"wspi","Kim Dae Bak Korean & Japanese (Keat Hong Shopping Centre)","Korean",4.9,18,"singapore","253 Choa Chu Kang Ave 1,  Keat Hong Shopping Centre, S 680253,"
"x0qm","BM Lanzhou Halal Ramen (Junction Nine)","Noodles",5.0,850,"singapore","18 Yishun Avenue 9 02-42,"
"dwz0","L32 Handmade Noodles (Bedok 211)","",5.0,69,"singapore","460211, 460211 Bedok, East, Singapore, Singapore,"
"si84","Mo Kebabs (211 New Upper Changi Road)","Mediterranean",4.9,56,"singapore","211 New Upper Changi Road #01-763 , stall -1,Singapore 460211,"
"ooz7","Little Tokio (Tampines Street)","Rice Dishes",4.9,32,"singapore","824 Tampines Street 81, East, Tampines, 01-22,"
"cnys","Shahana's Teh Tarik (Junction nine)","Tea",5.0,252,"singapore","Junction nine shopping mall #02-40B 768897,"
"sjt8","CHARR.BO GRILL (Yishun Street 11)","Western",4.9,56,"singapore","156 YISHUN STREET 11 #01-122,"
"a4f5","Xiang Xiang Fried Food (Choa Chu Kang Market & Food Centre) - Islandwide","Noodles",0.0,0,"singapore","Blk 253 Choa Chu Kang Market & Food Centre, Choa Chu Kang Ave 1, North, Choa Chu Kang,,"
"a3d5","Naga Kitchen (Keat Hong Close)","Malaysian",5.0,124,"singapore","802A Keat Hong Close #04-109,"
"ks1k","253 Satay (Choa Chu Kang Market & Food Centre)","Asian",4.6,7,"singapore","680253,  #01-17, 680253 Choa Chu Kang, North, Singapore, Singapore,"
"qtcg","Kow Loon Roasted (Keat Hong Close)","Chinese",0.0,0,"singapore","Blk 803 Keat Hong Close #01-01 Singapore 680803,"
"kior","MO's Wok N Wrap (Bedok Town Centre)","",0.0,0,"singapore","Block 211 HDB New Upper Changi, New Upper Changi Rd 211, 460211 Bedok, East, Singapore, Singapore,"
"m1su","Wan Wan Xiang Shou Gong Ban Mee (Yishun)","Asian",0.0,0,"singapore","Yishun Street 11 156, 760156 Yishun, North, Singapore, Singapore,"
"xxh5","Ajumma Bibimbap (Junction Nine)","",0.0,0,"singapore","18 Yishun Avenue 9, #02-05 Junction Nine, Jap stall s768897, S 768897,"
"yws5","Qiu Lim Yong Tau Foo (Choa Chu Kang Ave 1)","Chinese",0.0,0,"singapore","253 Choa Chu Kang Avenue 1, #01-24, Keat Hong Shopping Centre, Singapore 680253, MR2,"
"bknx","Ar Rayyan Restaurant (Choa Chu Kang)","Indian",4.9,1072,"singapore","253 Choa Chu Kang Ave 1, #01-21, Singapore 680253 (Keat Hong Shopping Centre),"
"y68e","Bedok 211 Chicken Rice (New Upper Changi)","Singaporean",5.0,262,"singapore","BLK 211 #01-1763 NEW UPPER CHANGI ROAD BEDOK CENTRAL,"
"j40t","MarlinaMuslimFood (824 Tampines St 81) - Islandwide","Rice Dishes",5.0,513,"singapore","Marlina Muslim Food, Tampines Street 81 BLK 824 At 824 BK Eating House, Beside Tenderbest., 520824 Tampines, East, Singapore, Singapore,"
"xpt7","Tang Umami Delights (190 Punggol Central)","Asian",4.9,19,"singapore","Blk 190 Punggol Central #13-291, S 820190,"
"a34k","828 Wuxiang, Satay, Congee, Mee Siam (823A Tampines St 81) - Islandwide","Singaporean",4.7,71,"singapore","Blk 823A Tampines Street 81, #01-02, Tampines, 521823,,"
"bl1m","Wrapsody (Bedok South)","Healthy",0.0,0,"singapore","18 Bedok South Road 460018, S 460018,"
"y6us","Yu Pan (Yishun)","Soups",5.0,1057,"singapore","317 Yishun Ave 9, #01-01,"
"g8et","An An Minced Meat Noodles (Tampines Street 81)","Chinese",4.9,428,"singapore","Blk 823a tampines St 81 #01_02 s(521823),"
"u5wp","I Love Sukhothai (Plantation Village)","",0.0,0,"singapore","126B Tengah Drive #01-339, S 692126,"
"hh21","FUJI FISHBALL NOODLE (872C Tampines)","Chinese",4.8,47,"singapore","872C Tampines Street 86 01-09 Happy Howker coffee shop #02 523872,"
"uytu","Teochew Fish Porridge (Tampines 826)","Seafood",4.8,35,"singapore","Blk 826 Tampines street 81 #01-86 Singapore 520826,"
"bbhe","Ri Cheng Economical Rice 日晨菜饭 (Yishun Street 11)","Chinese",3.0,7,"singapore","123 Yishun Street 11, #01-509, Inside Coffeeshop, Singapore 760123,"
"ku8y","Mr Tang Nourishing Herbal Soup (Bedok North)","Chinese",4.8,29,"singapore","136 Bedok North  Ave 3 #01-140 SG460136,"
"wvhw","Red Apple Vegetarian (Tampines)","Korean",5.0,378,"singapore","835 Tampines Street 83 #01-02,"
"wmwm","Delifishcious Fish Soup (Bedok)","Asian",0.0,0,"singapore","Pasar 16 @ Bedok, 16, Bedok S Rd, Bedok, East,,"
"v12a","LAI JIN CAI PAU DIM SUM (Yishun)","Chinese",4.5,15,"singapore","760239,  1150, 760239 Yishun, North, Singapore, Singapore,"
"lyfl","Pu Tian Ke (Bedok Town Centre)","Asian",4.9,562,"singapore","218 BEDOK NORTH STREET 1 #01-01 SINGAPORE 460218 (MR 3),"
"q06n","Udang Udang Prawn (Koufu HQ)","",4.9,73,"singapore","1 Woodlands Height #01-01, Koufu HQ, Singapore 737859,"
"u6xl","Tam Tam Viet Nam Bakery (Yishun)","Vietnamese",5.0,88,"singapore","110 Yishun Ring Road, #01-389 SG760110,"
"p8jw","Fried Bee Hoon (Yishun Street 21)","Chinese",4.9,453,"singapore","Block 233 Yishun Street 21,"
"kyc3","TL Beehoon (Temasek Polytechnic)","Singaporean",4.3,5,"singapore","Blk 4Flavours Food Court, 21 Tampines Ave 1 Unit no: #02-03, 529757,"
"v9sj","Mufiz Restaurant (Tampines)","",4.7,1136,"singapore","01-04, Blk 835 Tampines Street 83, Tampines, Simei,"
"gzh5","Crab Wang Seafood (Bedok)","Chinese",4.9,281,"singapore","Stall 08, Blk 760 Bedok Reservoir View, #01-337, Singapore 470760,"
"fh5q","Mari Mari Seafood (Koufu HQ)","Seafood",5.0,85,"singapore","1 Woodlands Height #01-01 MR4 (Koufu HQ) SG737859,"
"zhu2","AR RAHEEM EATING HOUSE (Tampines)","Indian",4.7,80,"singapore","872C TAMPINES STREET 86, #01-09,"
"lszs","My Curry Rice (Choa Chu Kang)","Rice Dishes",4.9,109,"singapore","Premise 2, Block 2, Chao Chu Kang Loop #01-02/03, Keat Hong CC, Singapore 689687 ((Nasi Lemak Ayam Taliwang),"
"s0qu","Pizza Arc (Yishun)","Italian",4.9,1946,"singapore","Pizza Arc,"
"x2nt","Yi Soon LaLa Hotpot by Nature Park Seafood (YISHUN )","Seafood",4.9,238,"singapore","233 YISHUN ST 21 #01-472 SINGAPORE 760233,"
"fnba","Hong Feng Roasted Delights Stew Soup (Yishun Ring Road)","Malaysian",0.0,0,"singapore","239 Yishun Ring Road #01-1150, S 760239,"
"s5kq","Club July (Stagmont Ring)","Seafood",4.8,631,"singapore","5 Stagmont Ring , Choa Chu Kang,"
"dt5s","HEI KOPI (CCK)","",4.9,22,"singapore","28 Choa Chu Kang Drive #01-02 S(689964,"
"x8nd","Hongkong Beef King (Cookhouse Koufu WWP)","Noodles",5.0,473,"singapore","83 Punggol Central 02-20/21,"
"w8qb","Wak Ana (16 Bedok South Rd)","Indonesian",5.0,2095,"singapore","01-08, 16 Bedok South Road, Bedok, Chai Chee,"
"qm1g","Nasi Ambeng Asli Jurong West (Woodlands Height)","Asian",0.0,0,"singapore","Nasi Ambeng Asli Jurong West
1 Woodlands Height, 
Koufu Group HQ 
#05-02 K13 S(737859)
(Use the carpark with your vehicle to 5th floor),"
"kgie","Justeat Nasi Lemak And Economic Bee Hoon (312A Sumang Link)","Chinese",5.0,1461,"singapore","312A Sumang Link #01-05 Singapore 821313,"
"l6eu","Shang Hai Shi Xiang Ge (Tampines Street 81)","Chinese",5.0,123,"singapore","823A Tampines Street 81, #01-01, Tampines, 521823,"
"v6pj","Ar-Raheeq Restaurant (Punggol)","Indian",5.0,2328,"singapore","01-01, Blk 622D, Punggol Central, Punggol,,"
"x0mx","Su Shi Yuan Vegetarian (Tampines Street 81)","Noodles",5.0,594,"singapore","823A Tampines Street 81, Singapore 521823,"
"jv7q","Sin Xiang Kee (Bedok North)","Chinese",4.9,131,"singapore","136 BEDOK NORTH AVE 3 460136,"
"efqh","Hua Xin Mala Xiang Guo (Plantation Crescent)","Asian",0.0,0,"singapore","BLK 127 Plantation Crescent, #03-02,"
"g5bl","Carvee & Kylie Filipino Food (Yishun Ring Road)","Asian",0.0,0,"singapore","Yishun Ring Rd 115A Unit number 02-829, 761115 Yishun, North, Singapore, Singapore,"
"asp5","Zesty Acai (Choa Chu Kang)","Dessert",4.9,25,"singapore","282 Choa Chu Kang Avenue 3, #12-432, 680282,"
"qa0t","Oba-Chan Bento (Junction Nine)","",0.0,0,"singapore","18 Yishun Avenue 9, #02-05 Junction Nine, Jap stall s768897, S 768897,"
"f3hh","You You Fish Soup (Tampines Street 81)","Seafood",0.0,0,"singapore","520828, 520828 Tampines, East, Singapore, Singapore,"
"oehf","16 Bedok Minced Meat Noodle (Bedok South Road)","Chinese",4.9,140,"singapore","16 bedok south rd #01-23, 460016,"
"wrrg","Oh!Zaika (Woodlands)","Indian",0.0,0,"singapore","Zaika Cuisine, Woodlands Height 1 #03-06, 737859 Woodlands, North, Singapore, Singapore,"
"ucjz","Ah Hua's Kitchen - Tampines Grove (Tampines St 81)","Malaysian",5.0,1010,"singapore","Tampines Street 81, Block 826, Singapore 520826, #01-86,"
"w5zx","Qiu Lin Herbal Soup.Seafood 秋林老火汤小厨 (Junction Nine)","Chinese",4.9,637,"singapore","01-13, 18 Yishun Avenue 9, Junction 9, Sembawang, Yishun,"
"lm97","Creamed (Junction Nine)","Pasta",5.0,397,"singapore","Junction 9, 18 Yishun Ave 9 #02-19 SG768897,"
"gg38","Chong Pang Huat (Tampines Street 81)","Asian",4.9,31,"singapore","828 Tampines Street 81, S 520828,"
"aoeo","Blk 826 Hokkien Prawn Mee (Tampines Street 81)","Noodles",4.8,51,"singapore","Tampines Street 81 Block 826 520826,"
"aqk1","KING'S BIRYANI & BBQ RESTAURANT (New Upper Changi Road)","Indian",4.8,5,"singapore","26 NEW UPPER CHANGI ROAD #01-656 SINGAPORE,"
"h66w","KRAPOW EXPRESS (Punggol Central)","",4.9,39,"singapore","Punggol Central 301, 820301 Punggol, North, Singapore, Singapore,"
"ebbr","Sinar Sumang (Sumang Link)","Malaysian",5.0,322,"singapore","312A Sumang Link, #01-05, Singapore 821312,"
"ipl9","Baan Khun Yai (Punggol Central)","Thai",0.0,0,"singapore","Punggol Central 188, 820188 Punggol, North, Singapore, Singapore,"
"qi3m","79 Charcoal Roasted Delights (Yong Li Coffee Station)","Asian",5.0,95,"singapore","136 Bedok North Avenue 3 (Yong Li Coffee Station) 460136,"
"exnb","Ichi Umai (Junction Nine)","Rice Dishes",5.0,261,"singapore","18 Yishun Ave 9 #01-19, Junction 9 SG768897,"
"ixbm","Percolate (136 Bedok North Ave 3) - Islandwide","Coffee",5.0,6,"singapore","01-152, 136 Bedok North Avenue 3, Bedok, Chai Chee,"
"pb0b","Li Fang Congee (Tampines)","",4.1,9,"singapore","Block 828 HDB Tampines, Tampines Street 81 828 #01-254 STALL 3, 520828 Tampines, East, Singapore, Singapore,"
"caop","He Le Delight HK Roasted Style (Yishun)","Asian",2.3,6,"singapore","123 Yishun Street 11 #01-509, S 760123,"
"adu0","Yuan Wei HK Wanton Noodles (26 New Upper Changi Road)","Asian",4.8,10,"singapore","26 New Upp Changi Road #01-656 (S)462026,"
"k6rt","Happy Chef Kitchen (18 Bedok South Rd)","Chinese",4.8,375,"singapore","18 Bedok South Road #01-45, Singapore, 460018,"
"x6kv","Spicy Thai Thai Cafe (Bedok North Street)","Thai",4.9,852,"singapore","218 Bedok North Street 1 #01-01,"
"owem","旺德福中餐厅 BBQ 火锅 (218 Bedok North Street 1)","",4.9,151,"singapore","460218,  218 BEDOKNORTHSTREET1 #01-01, 460218 Bedok, East, Singapore, Singapore,"
"w6vj","Tampines 826 Chicken Rice & Traditional Claypot Rice (826 Tampines Street 81)","Chicken Rice",4.9,129,"singapore","01-86, 826 Tampines Street 81, Tampines, Simei,"
"zuyo","Al Fatihah Indian & Malay Muslim Food (Yishun)","Asian",0.0,0,"singapore","Blk 256 yishun ring road  Unit 01-1005 sunshine  Singapore 760256,"
"x2ko","Tian Tian Kai Xin Mala Xiang Guo 天天开心麻辣香锅 (Bedok)","",4.9,1298,"singapore","Blk16 Bedok South Road #01-26,"
"r5sh","Wangs Roasted Delight (Tampines Street 81)","Chicken Rice",4.8,62,"singapore","Blk 823A Tampines Street 81 #01-02 (Stall 1), Singapore 521823,"
"sjr5","Danlao (Koufu @ Waterway Point)","Asian",4.9,39,"singapore","83 Punggol Central, #02-20, Cookhouse by Koufu, Stall No.: 13,"
"c7kv","Lam's Noodle & Salt Baked Chicken (Cookhouse Koufu WWP)","Noodles",4.9,1321,"singapore","83 Punggol Central 02-20/21,"
"ru00","Al Bismi Restaurant (Hougang)","",0.0,0,"singapore","Bedok North Street 1 218, 460218 Hougang, North, Singapore, Singapore,"
"fdsm","Manasa'La Tandoor (Broadway)","Asian",4.9,687,"singapore","760 Bedok Reservoir View #01-337,"
"kfgv","Master Leong Seafood 良师傅海鲜煮炒 (Yishun Ring Road)","Seafood",4.9,1186,"singapore","256 Yishun Ring Road #01-1005 S760256,"
"rj1f","Paik's Noodle (Waterway Point)","Korean",4.8,54,"singapore","83 Punggol Central, 02-21 Waterway Point Singapore 828761 (Left Wing),"
"wmzm","Makan Singapura (Keat Hong Community Club)","Asian",4.9,119,"singapore","2 CHUA CHU KANG LOOP, KEAT HONG CC, #01-02/03,"
"smql","Cluckin' Good SG (Punggol Central)","American",0.0,0,"singapore","301 Punggol Central, Singapore 820301, S 820301,"
"v7vi","Al Habib - Best Cafe Group (312A Sumang)","Indian",4.9,5345,"singapore","01-05, 312A Sumang Link, Punggol, Sengkang,"
"c9rj","Penyet King (Cookhouse Koufu WWP)","Indonesian",5.0,546,"singapore","83 Punggol Central, #02-20, Singapore, Singapore, 828761,"
"tnhc","99 K-DON (Yishun Ring Road)","Japanese",0.0,0,"singapore","760239, 760239 Yishun, North, Singapore, Singapore,"
"ydo4","Choo's Wok (Upper Changi)","Chinese",4.8,5,"singapore","26 New Upper Changi Road #01-656 S462026,"
"mvf8","SSL Vegetarian 顺顺来素食 (Koufu HQ)","",4.9,233,"singapore","1 Woodlands Height, #05-S02, Koufu HQ Foodcourt S737859,"
"zr4q","Thai Empire (Woodlands)","Thai",4.1,6,"singapore","1 Woodlands Height, Stall MR1 #01-01 - Koufu Group HQ SG737859,"
"lv6i","Tuk Tuk Cha (Waterway Point) - Islandwide","Thai",4.9,17,"singapore","#B1-K8, 83 Punggol Central, Waterway Point, Punggol, Sengkang,"
"asjv","Ayam Baekz (Punggol Central) - Home-Based Vendor","",5.0,294,"singapore","822623,  punggol spectra #11-356, 822623 Punggol, North, Singapore, Singapore,"
"bl8k","Mr Teh Tarik Cartel (Choa Chu Kang)","",5.0,212,"singapore","28 Choa Chu Kang Drive #01-05 SG689964,"
"gl21","Le Xiao Chu (322 Sumang Walk)","Chinese",4.9,100,"singapore","BLK 322 SUMANG WALK #01-01 (S),"
"p1m4","Talad Thai (Punggol)","Thai",5.0,56,"singapore","83 Punggol Central, #B1-K4, Waterway Point, Singapore 828761, S 828761,"
"mq9c","XI AN NOODLES SHOPS 西安面馆-麻辣烫 (Chinese Garden)","Chinese",4.9,119,"singapore","151 BOON LAY WAY #01-01 CHINESE GARDEN MRT STATION 609959,"
"x5kw","Jia Jia Fishball Noodle (Yishun)","Soups",4.9,264,"singapore","233 Yishun Street 21,"
"w2pl","D' Snack Station (Tampines Street 83)","Asian",5.0,463,"singapore","Blk 835 Tampines Street 83, #01-16,"
"z7if","Happy Lok Lok (Punggol)","",5.0,251,"singapore","6 Tebing Lane #01-05, Singapore 828849,"
"w8ct","Al Fatthah Food Expo Restaurant (Yishun)","Indian",5.0,2987,"singapore","01-01, 18 Yishun Avenue 9, Yishun, Sembawang,"
"rd7u","Elemen (Koufu HQ)","Pizza",4.9,30,"singapore","1 Woodlands Height #01-02, S 737859,"
"na78","The Ice Cream store (Punggol)","Ice Cream",5.0,8,"singapore","821 Punggol Road, Shell Punggol Service Station 829169,"
"ifhi","Ngon Ngon (Yishun)","Vietnamese",5.0,61,"singapore","Block 253 Yishun Ring Road (Yishun Sunshine) #06-1047 Singapore 760253,"
"fnpk","Old Amoy Chendol (Choa Chu Kang)","Dessert",4.9,29,"singapore","Foodfare @ Choa Chu Kang Centre, 309 Choa Chu Kang Ave 4, S 680309,"
