"StoreId","CompleteStoreName","FoodType","AverageRating","Reviewers","City","Location"
"azhs","Thai Savoury (55 Serangoon North)","Thai",4.9,717,"singapore","55 Serangoon North Ave 4 #01-15,"
"y1rv","Divine Chicken Pot (Kopitiam PLQ)","Chinese",5.0,840,"singapore","10 Paya lebar RD #04-11 stall No.9 paya lebar quarter S409057,"
"eg5v","Da Dong Bei BBQ 大东北烧烤 (Upper Serangoon Road)","Chinese",5.0,31,"singapore","1008 upper serangoon road,"
"m4cx","SOI 72 Thai Bistro (Grandlink Square)","Thai",4.9,410,"singapore","511 GUILLEMARD ROAD, GRANDLINK SQUARE #01-56, SINGAPORE 399849,"
"x4kh","FlagWhite (Jalan Jurong Kechil)","American",5.0,217,"singapore","106 Jalan Jurong Kechil,"
"mhqy","Waroeng Esmeralda (Wong Poh Kopitiam)","Malaysian",5.0,325,"singapore","Blk 3026 #01-146 Ubi Road 1 S408719 Stall 9,"
"x9lm","Selegie Soyabean (Upp Serangoon)","Dessert",5.0,2625,"singapore","1002 Upp Serangoon Road, Tai Peng Garden, Singapore 534740,"
"syql","Yum Yum Thai (PLQ Mall)","Chicken",5.0,28,"singapore","10 Paya Lebar Road #B2-15 PLQ Mall,"
"x6fw","Hanis (Paya Lebar)","Western",4.9,1293,"singapore","10 Paya Lebar Road #B2-18 Paya Lebar Quarter PLQ Mall Singapore,"
"wf6u","Charcoal Claypot Crab (Ubi Road)","",0.0,0,"singapore","Block, 3014B Ubi Rd 1, 408722, S 408722,"
"uf7x","Sp3 Chicken Rice (Dover Road)","",4.7,21,"singapore","500 Dover Road , Polytechnic  Singapore Foodcourt 3, S139651,"
"v5ex","Woorinara Korean Restaurant (Lorong Kilat)","Korean",4.9,515,"singapore","#01-02, 19 Lorong Kilat, Beauty World,"
"c8cv","London Fat Duck (PLQ) - Islandwide","Chinese",4.9,113,"singapore","10 Paya Lebar Road, PLQ Mall, #B2-25,"
"w6dx","Nayana Kpop Cafe & Restaurant (Flora Vista)","Korean",3.8,193,"singapore","01-13, 7 Ang Mo Kio Street 66, Floravista, Ang Mo Kio,"
"q8jt","Pastamania (Paya Lebar Square)","Pasta",5.0,474,"singapore","60 Paya Lebar Rd, #01-09/10,,"
"v3zw","Kajiken (Paya Lebar Square)","Noodles",5.0,971,"singapore","#01-86, 60 Paya Lebar, Road, Paya Lebar Square, Paya Lebar, Macpherson,"
"y2gh","Cafe Red Ginger (PLQ)","Malaysian",5.0,973,"singapore","10 Paya Lebar Road, Paya Lebar Quarter, #B2-31 Singapore, Singapore 409051,"
"nucz","ACE Western (Singapore Polytechnic)","Japanese",4.9,58,"singapore","500 Dover Rd, Dover Rd 500 Singapore Polytechnic, food court 3, Stall no. 10, 139651 Clementi, West, Singapore, Singapore,"
"w8ys","Lotus Thai Restaurant (Paya Lebar Square)","Thai",4.9,1273,"singapore","02-13/14, 60 Paya Lebar Road, Paya Lebar Square, Paya Lebar, Macpherson,"
"rjiv","Ju Bao Xuan Mala Hotpot 聚宝轩麻辣香锅 (KopiTime @ PLQ)","Chicken",4.9,50,"singapore","10 PAYA LEBAR ROAD #04-11 PLQ MALL,"
"bsm7","Haji S.M Hatheem Indian Muslim Food (Hougang)","Indian",5.0,409,"singapore","107 Hougang Avenue 1 #01-00 SG530107,"
"b6kn","Flip's N Dips (Paya Lebar)","Rice Dishes",4.9,3672,"singapore","60 Paya Lebar Rd, #B1-51 Paya Lebar Square, Singapore 409051,"
"ux49","Zoul’s Corner 107 (Hougang Avenue 1)","Indonesian",5.0,167,"singapore","Blk 107 HOUGANG AVE 1 s530107, stall 4, S 530107,"
"rdo2","Mr Meepok (Hougang)","Asian",0.0,0,"singapore","212 Hougang St 21, #01-349, Singapore 530212,"
"bg28","21 Seafood (Hougang Street) - islandwide","Seafood",4.6,16,"singapore","Blk 212 Hougang Street 21 01-347,"
"q4az","Tingkat Peramakan (PLQ)","Singaporean",4.6,103,"singapore","10 Paya Lebar Rd #B2-03, Singapore,"
"x5gf","Shanghai Family Restaurant (Geylang Road)","Chinese",4.7,624,"singapore","789 Geylang Rd Unit 01-01,"
"y1ck","SALVO by Pasta Fresca (PLQ)","Pasta",4.6,74,"singapore","2 Tanjong Katong Rd, #01-05, PLQ3,"
"d521","Riverside Sichuan BBQ (Guillemard Road)","Asian",4.4,13,"singapore","511, Guillemard Road, #01-25,"
"gndq","Meeting Mee (Hougang Ave 1)","Asian",0.0,0,"singapore","106 Hougang Ave 1 #01-1239, S 530106,"
"oubo","Famous Eunos Bak Chor Mee (Lorong Ah Soo)","Noodles",4.8,203,"singapore","Hougang Ave 1, Block 106, Singapore 530106,"
"zm9d","SMOKEY OAK (Guillemard Road)","Western",3.8,6,"singapore","511 Guillemard Rd, #01-07,"
"v4vi","Taste Of Indonesia (Paya Lebar Square)","Indonesian",4.9,2688,"singapore","#B1-29/30/31, 60 Paya Lebar Road, Paya Lebar Square, Paya Lebar, #B1-08"
"v4no","Merdandy Bar & Cafe (Guillemard Road)","American",3.9,289,"singapore","511 Guillemard Road, #01-54"
"x1jn","CHICHA San Chen (PLQ Mall)","Bubble Tea",4.8,2900,"singapore","02-27 PLQ Mall 10 Paya Lebar Rd, Singapore,"
"y7sm","Hong Fa Handmade Noodles (644 Hougang Avenue 8)","Noodles",4.9,528,"singapore","Block 644 hougang ave 8,"
"r5cd","NeNe Neko Japanese Cafe & Izakaya (PLQ)","Japanese",0.0,0,"singapore","10 Paya Lebar Rd, #01-K7 PLQ PLAZA, Singapore 409057,"
"xl4j","Pak Lum Malaysian Cuisine (Paya Lebar Rd)","Malaysian",3.8,6,"singapore","60 Paya Lebar Rd, #B1-51 Paya Lebar Square, Cantine, S 409051,"
"lw5q","Lai Yuan Gourmet (Hougang Avenue 1)","Chinese",0.0,0,"singapore","107 Hougang Avenue 1, #01-00,"
"fa4r","Rong Wantan Noodle Original 287 Tanjong Katong Rd (Singpost Centre)","Chinese",4.9,129,"singapore","10 Eunos Rd 8, #02-142/143, Singpost Centre,"
"t81o","Manna Korean Restaurant (Singapore Post Centre)","Korean",4.8,160,"singapore","#02-138/139, 10 Eunos Rd 8, Singapore Post Centre, S(408600),"
"o1v8","Jai Siam (Paya Lebar)","Seafood",4.8,191,"singapore","10 Eunos Road 8 #B1-148 SingPost Centre, Singapore, 408600,"
"uqqc","Grill Yard (Ubi)","",0.0,0,"singapore","Ubi Ave 3 50, 408866 Ubi, East, Singapore, Singapore,"
"p6sw","Malaysia Chiak (Singpost)","Singaporean",4.9,258,"singapore","10 eunos road 8 #B1-151/152,"
"vg8u","Kyoto Japanese Cuisine (Food Loft Ubi Road 1)","Japanese",5.0,89,"singapore","3014B Ubi Road 1 SG408722,"
"l1mr","Cui Xiang Yuan Restaurant (Telok Blangah Heights)","Chinese",4.7,345,"singapore","#01-121, Block 61 Telok Blangah Heights, Singapore 100061,"
"q3bi","New Thai Kitchen & Thai Paradise (Hougang)","",5.0,44,"singapore","Blk 644 Hougang ave 8 #01-257, Broadway, S 530644,"
"q2hp","Creammy Thai (Hougang Avenue 8)","Singaporean",4.8,14,"singapore","644 Hougang Ave 8, #01-257 Broadway Coffee Shop,"
"cv86","Lao Wei Dao Yong Tau Foo (PLQ)","Asian",4.6,10,"singapore","10 Paya Lebar Rd, #04-11 PLQ Mall, KopiTime, S 409057,"
"aa3e","Eclipse (Hougang)","",4.4,5,"singapore","Stars of Kovan, Upper Serangoon Rd 988, 534733 Hougang, North, Singapore, Singapore,"
"h987","Taste Good 好味小厨 (Ubi Road 1)","Chinese",0.0,0,"singapore","3014B Ubi Road 1 #01-01 (Food Loft Coffeeshop), Singapore 408722,"
"fg7b","ASTONS Specialities (Singpost Center)","Grill",5.0,311,"singapore","10 Eunos Road 8, Singpost Centre #01-114/115, 408600,"
"aq1i","Fu Xiao Fish Soup 福笑鱼汤 (PLQ Mall)","Seafood",4.6,12,"singapore","10 Paya Lebar Rd, #04-11 Stall 16, Singapore 409057,"
"v9wd","Cake Avenue (Kilat Centre)","Cakes",5.0,476,"singapore","01-01/02, 33 Lorong Kilat, Kilat Centre, Jurong East, Clementi,"
"fi49","South Side (Keppel 1557) - Islandwide","Vegetarian",0.0,0,"singapore","1557 Keppel Road #01-04, Keppel 1557, Singapore 089066,"
"vv72","Oven & Fried Chicken (Normanton Park) - Islandwide","Fried Chicken",4.8,7,"singapore","63 Normanton Park .01-88 , 117287, Singapore, Singapore,"
"srxs","Tamagood (Dover Road)","",0.0,0,"singapore","500 Dover Road , Singapore Polytechnic, Foodcourt 4 (Koufu), Stall 4, 139651 Clementi, West, Singapore, Singapore,"
"h5yj","Chicken Run (Paya Lebar Square)","Singaporean",4.5,410,"singapore","60 Paya Lebar Road, #02-18/19,"
"b19f","Joo Chiat Fish Soup (18 toh yi)","Chinese",0.0,0,"singapore","Blk 18 Toh Yi drive 01-97,590018,"
"r9rl","Pu Tian (Xing Hua) Food","Noodles",4.9,391,"singapore","10 Paya lebar Road #04-11 S409057,"
"zrby","Urban Eats Factory (UB Point)","Asian",0.0,0,"singapore","UBPoint, Ubi Ave 1 61, #02-01, 408941 Ubi, East, Singapore,"
"t2ns","Chef de Pasta (Kovan)","Western",5.0,19,"singapore","Blk 212 Hougang Street 21, #01-349 Singapore 530212,"
"gfcl","Bread and Butter (Flora Vista)","",5.0,7,"singapore","7 Ang Mo Kio Street 66 #01-08 Flora Vista,"
"g8af","What The Fish (PLQ Mall)","Seafood",4.8,103,"singapore","10 Paya Lebar Rd, PLQ Mall, #04-11, Kopitiam Stall 5,"
"j7x6","7-Eleven Restaurant (63 Normanton Park )","Asian",0.0,0,"singapore","Normanton Park #01-84/85 Singapore117287,"
"fytk","Fruicey (68 Jalan Jurong Kechil)","Beverages",5.0,39,"singapore","68 Jln Jurong Kechil, West, 01-10 , Suites at Bukit Timah, 596180,"
"fccr","Fluff Stack (Paya Lebar Quarter Mall)","Dessert",5.0,34,"singapore","10 Paya Lebar Road B1-K3 Paya Lebar Quarter Mall Singapore,"
"fk38","Tasmac Bar & Bistro (PSA Pass Centre)","",0.0,0,"singapore","Tasmac Bar Bistro, Keppel Rd 7, 089053 Tanjong Pagar, Central, Singapore, Singapore,"
"x5de","Western Mahua (PLQ)","Noodles",4.9,485,"singapore","10 Paya Lebar Road, #B2-28 Paya Lebar Quarter mall,"
"x0zh","SMOL (PLQ)","Healthy",4.9,334,"singapore","2 PAYA LEBAR ROAD #01-05 PARK PLACE RESIDENCES AT PLQ PARKSIDE SINGAPORE 409053,"
"vy5w","Peng You Quan Mei Shi Zhi Shang Hai Ren Jia 朋友圈美食之上海人家 (Geylang Road)","Asian",0.0,0,"singapore","789 Geylang Road, Singapore 389675,"
"y3lw","Donburi King (PLQ Mall)","Japanese",4.9,238,"singapore","10 Paya Lebar Rd, Paya Lebar Quarter PLQ  #03-26, Singapore,"
"hi8e","Nikutosake (PLQ Mall)","Japanese",4.4,6,"singapore","10 Paya Lebar Road #01-38, PLQ MALL SG409057,"
"gwq7","Delifrance (SingPost Centre)","Sandwiches",5.0,312,"singapore","10 Eunos Road 8 #01-141A/141B Singapore 408600,"
"yrr7","Yummy Hanoi (Paya Lebar)","Vietnamese",0.0,0,"singapore","60 Paya Lebar Road #B1-51 SG409051,"
"muiu","Sally Vietnam Food (Psa Pass Centre)","Vietnamese",4.9,39,"singapore","PSA Tanjong Pagar Complex, 7, Keppel Rd, Central, Tanjong Pagar, #01-23,"
"v6kg","Outram Ya Hua Rou Gu Cha Restaurant (Keppel Road)","Asian",4.9,1147,"singapore","01-05/07, 7 Keppel Road, Lower Central, Tanjong Pagar,"
"xcg2","Don Lechon (Grandlink Square - Paya Lebar) - Islandwide","Filipino",5.0,88,"singapore","511 Guillemard Road #01-52, Grandlink Square, Singapore 399849,"
"hahp","Lok Fu Lalapot Restaurant (PSA Pass Centre)","Asian",0.0,0,"singapore","Lok Fu Restaurant 六福大排檔啦啦煲, Keppel Rd 7 #01-10/11, 089053 Tanjong Pagar, Central, Singapore, Singapore,"
"fot2","Eat Pizza (PLQ Mall)","Pizza",4.9,133,"singapore","10 Paya Lebar Road, Paya Lebar Quarter, #01-K5 PLQ Mall, S(409057),"
"lv66","Zhengxin Chicken Steak (Paya Lebar）","",4.9,36,"singapore","60 Paya Lebar Rd, #01-71/K6/K7 Paya Lebar Square, Singapore 409051,"
"s6cm","The Soup Spoon Union (Paya Lebar)","Soups",5.0,4137,"singapore","#01-11, 60 Paya Lebar Road, Paya Lebar Square,"
"oey6","Fang Handmade Curry Puff (Ubi Road 2)","",5.0,50,"singapore","8 Ubi Road 2, #01-15 Stall 05, Zervex Building, Singapore 408538,"
"cthf","Aafiyah By Naser (Dover)","Malaysian",4.9,54,"singapore","10 Dover Drive, S 138683,"
"x7ji","Foodie Cuisine (Haig Road)","Western",4.9,412,"singapore","stall number 01-43, 14, Haig Road Market Food Center, stall number 01-43"
"ss73","QQ Rice Nus 16 (Science Drive)","Asian",0.0,0,"singapore","S16, Level 1, Kiosk 2, 3 Science Dr. 2, NUS 117543 Singapore,"
"jsiz","Bub Coffee (Science Park)","Coffee",0.0,0,"singapore","5 Science Park Drive, Shopee Singapore, #03-09,"
"a3vg","Tai Mei Wei (Hougang One)","Asian",4.9,1128,"singapore","1 Hougang Street 91, #01-04 Hougang 1 Singapore 538692,"
"m82i","Pho Lotus Vietnamese Cuisine (Science Park Drive)","Vietnamese",0.0,0,"singapore","Science Park Dr 7, 119316 Clementi, West, Singapore, Singapore,"
"ypfz","Hougang Otah (Hougang One)","Malaysian",5.0,5,"singapore","1 Hougang Street 91 #01-19, Hougang One (Inside Warong Pak Sapari) SG538692,"
"nazs","Bibimbap! (SingPost)","Korean",5.0,231,"singapore","SingPost Centre, 10, Eunos Rd 8, East, Paya Lebar, B1-154, Singapore 408600,"
"x6oc","Kazuki (Kent Ridge)","Japanese",5.0,368,"singapore","1 Lower Kent Ridge Road, One @ Kent Ridge, #01-18,"
"v4yk","MFC - My First Choice (Kinex)","American",4.9,763,"singapore","11 Tanjong Katong Road, #B1-K7 Kinex
437157 Singapore,"
"qmr0","Koo Kee (SingPost Centre)","Noodles",4.8,1115,"singapore","10 Eunos Road 8, #B1-126,"
"yocu","Jiak Pork Ribs Prawn Noodle (703 Hougang Ave 2)","Noodles",4.5,23,"singapore","703 Hougang Ave 2, Singapore 530703 #01-201,"
"rqdf","Mentai SENS (Clementi)","Japanese",4.9,544,"singapore","107 Clementi Street 12 (Sunset Way) #01-K1, Singapore, 120107,"
"x3hn","Pizza Republic (Ascent)","Pizza",4.8,397,"singapore","2 Science Park Drive,"
"ndfu","Thai Cuisine from Phitsanulok (Ubi Avenue)","Thai",4.8,44,"singapore","152 Ubi Avenue 4, #01-01,"
"dpua","A3 Bakery Cafe (Tampines) - Home-Based Vendor","Bakery",0.0,0,"singapore","111 Tampines Rd #01-04 535133,"
"mtif","STOKED! (The Oasis)","Rice Dishes",4.9,11,"singapore","87 Science Park Dr, 87, Outer Central, NUH, Oasis, #01-03 118260,"
"ypmw","Bombay Garden - Indian Cuisine (Science Park) - Restaurant Delivery","",3.9,5,"singapore","7 SCIENCE PARK DRIVE #01-25,"
"mvmm","Oasis Hideout (Dover Road)","Pizza",4.9,21,"singapore","1010 Dover Rd, #01-06 Singapore Polytechnic Graduate Guild, S 139658,"
"jqn6","Grillhaus (Wang coffee town)","Western",0.0,0,"singapore","GRILLHAUS, Ubi Rd 3 3024 #01-99Wang coffee town, 408652 Ubi, East, Singapore, Singapore,"
"uc1s","Kimly Dim Sum (Hougang St 22)","Dim Sum ",5.0,386,"singapore","Blk 246, Hougang street 22,"
"awmx","Parched (Aspial One)","Dessert",4.9,40,"singapore","Aspial One, Atrium Space, 55 Ubi Ave 3, 408864, S 408864,"
"ftiy","Hundred Acre Creamery (Clementi Street)","Dessert",5.0,31,"singapore","Clementi Street 11, Block 109, #01-37, Singapore 120109,"
"wgen","Zheng Kampong Hainanese Chicken Rice (Singapura Heritage Singpost Centre)","",4.9,11,"singapore","10 Eunos Road 8, #02-142/143,"
"oipz","Kopifellas Kiosk (Oasis)","Coffee",5.0,9,"singapore","87 Science Park Drive, #01-04, Oasis, Singapore Science Park 1 118260,"
"mjyb","Daily Serve Foodie (Hougang Avenue 2)","Beverages",3.7,34,"singapore","709 Hougang Avenue 2 #10-103, Singapore 530709,"
"abuo","KVR Foods (Ubi Techpark）","",0.0,0,"singapore","Ubi Cres 10 Lobby A, 408564 Paya Lebar, East, Singapore, Singapore,"
"mpdl","Picky Snout (Upper Serangoon Road)","Cakes",5.0,64,"singapore","1014 Upper Serangoon Road   Singapore, S 534752,"
"cv4x","Chong City Penang Laksa (City Plaza)","Noodles",3.8,19,"singapore","810 Geylang Rd, #05-02 City Plaza,, S 409286,"
"ry5w","Yu Yu Chuan Xiang Shui Zhu Yu (Ubi)","",0.0,0,"singapore","179 Ubi Avenue 4 #01-05 SG408793, S 408793,"
"cx7p","Camsuma Japanese Fusion Bowl & Noodle ( Alexandra)","Curry",0.0,0,"singapore","438 C Alexendra Road, Unit 0201, Food Haden Food Court, 119976 Singapore,"
"w7ez","Cream in a Cup (Hougang Ave)","Western",4.7,133,"singapore","Blk 678, Hougang Ave 8, #01-515,"
"tjkh","Kebab #1 (KINEX)","Middle Eastern",0.0,0,"singapore","11 Tanjong Katong Rd, #B1-K3, KINEX, S437157,"
"s9eo","Sod Cafe (Ci Yuan)","Western",5.0,4022,"singapore","51 Hougang Avenue 9,"
"pimp","Red Lantern Seafood (Telok Blangah)","Chinese",4.9,969,"singapore","65 TELOK BLANGAH DRIVE #01-144 BLANGAH VIEW,"
"fblt","The Summer Acai (Singpost Centre)","Dessert",5.0,434,"singapore","10 Eunos Road 8 #03-104 S408600,"
"w6m5","The Beignets (Hougang)","",0.0,0,"singapore","248 Hougang Ave 3 #10-428 SG530248,"
"oaxg","Lovebite Muffin & Western Food (10 Ubi Crescent)","Chicken",5.0,60,"singapore","10 UBI CRESCENT #01-04 STALL 2, S 408564,"
"m2ql","Japanese Food (Nuh)","Japanese",4.9,751,"singapore","5 Lower Kent Ridge Road #01-01 NUH Main Building, S119074,"
"ryx7","Huat Heong Bak Kut Teh (NUH)","Malaysian",4.9,273,"singapore","5 Lower Kent Ridge Road, NUH, Level 1 main Building Zone G, STALL MR1 SG119074,"
"uvgh","Jiro Restaurant (Aspial One)","",0.0,0,"singapore","55 Ubi Ave 3, Aspial one, Singapore 408864, S 408864,"
"fmt3","Rasa Sedap (Kedai Kopi Haig Road)","Fried Rice",4.9,373,"singapore","12 Haig Road #01-323, S 430012,"
"mc8f","Korean Food (Kopitiam @ Hougang One)","Chicken",4.7,56,"singapore","1 Hougang Street 91 Stall 17, Singapore 538692, S 538692,"
"gbam","Uncle Sam Tuckshop (703 Hougang Avenue)","Asian",4.1,12,"singapore","703 HOUGANG AVENUE 2 #01-201 SINGAPORE,"
"x5oa","Buttercake N Cream (Sunset Way)","Cakes",4.8,220,"singapore","Blk 106 Clementi St 12, Sunset Way 01-52,"
"rkd7","CHASHE (KINEX)","Bubble Tea",0.0,0,"singapore","Tanjong Katong Rd 11 KINEX Mall, #01-49, 437157 Paya Lebar, East, Singapore, Singapore,"
"e1i2","Garam Masala Indian And Tandoor- Restaurant Delivery (Science Park Drive)","Indian",1.4,7,"singapore","7 SCIENCE PARK DRIVE #01-25, S 119316,"
"bsw5","Stuff'D (Hougang 1)","Mexican",4.2,7,"singapore","1 HOUGANG STREET 91 #01-01 HOUGANG 1 SINGAPORE 538692,"
"g9to","4 EYES GUYS KITCHEN (Telok Blangah Street 32)","Chinese",4.8,133,"singapore","78A Telok Blangah Street 32, #02-01, MR4 Singapore 101078,"
"v6rb","The Restaurant (Buona Vista)","Seafood",4.2,18,"singapore","1010 Dover Road, Poly Gate 4, Singapore Polytechnic Graduates' Guild, SPGG, Bukit Timah, Buona Vista,"
"qag0","Feng Yuan Ban Mian 丰源板面 (Hougang One)","Chinese",4.8,84,"singapore","1 Hougang Street 91, #01-19 Hougang 1, Singapore 538692,"
"e3g9","Loi Ming (Haig Road)","Porridge",5.0,130,"singapore","14 Haig Rd, Haig Road Market & Food Centre #01-49, S 430014,"
"izfs","Ordinary Burgers (Lower Kent Ridge)","American",5.0,119,"singapore","1 Lower Kent Ridge Rd, #01-25, Singapore 119082,"
"fmml","Sando (Alexandra Technopark)","Asian",0.0,0,"singapore","SANDO at Alexandra Technopark, Alexandra Rd 438C New Tech Park, 119976 Telok Blangah, Outer Central, Singapore, Singapore,"
"datm","Soon Huat Bak Kut Teh (Kinex) - Islandwide","Asian",4.9,9,"singapore","11 Tanjong Katong Road #B1-K5,"
"y6qb","Ipoh Buntong Tea House (Ciyuan Hawker Centre)","Chinese",0.0,0,"singapore","51 Hougang Avenue 9, #01-17, Singapore 538776,"
"etns","Horiginal Beef Noodle (Telok Blangah)","Noodles",4.9,204,"singapore","78a Telok Blangah St 32 #02-01,"
"b0af","Super Coconut (Hougang 1)","Beverages",5.0,496,"singapore","1 hougang st 91 #01-34 hougang 1,"
"v0ve","Yi Dian Xin Hong Kong Dim Sum (Kovan)","Dim Sum ",4.9,1335,"singapore","1014 Upper Serangoon Road, Kovan, Hougang/Serangoon,,"
"k1ya","Haakon Superfoods & Juice (Kinex)","Healthy",4.9,1457,"singapore","11 Tanjong Katong, KINEX, #02-K3,"
"cy3k","Mr Teh Tarik Express (Eunos Road)","Asian",4.1,52,"singapore","10 Eunos Road 8, #01-131 Singapore Post Centre,"
"ym41","Partee Golf  & Bistro (Science Park Drive)","Western",0.0,0,"singapore","87 Science Park Dr, #02-01/02 Oasis Science Park, Singapore 118260,"
"n1wl","Sherlock's (Ascent)","Indian",2.0,1,"singapore","2 Science Park Drive , # 01-17 , Singapore-118222,"
"w3hh","Li Fang Congee (KINEX)","Porridge",5.0,2802,"singapore","11 Tanjong Katong Road, #B1-K9, Kinex,"
"dond","Tian Tian Lai Ban Mian Fish Soup (Paya Ubi Industrial Park)","Noodles",4.9,67,"singapore","51 Ubi Avenue 1 #01-17, Paya Ubi Industrial Park, Singapore 408933,"
"fn5l","Marais Coffee & Bakes (Kinex)","Bakery",4.9,56,"singapore","11 Tanjong Katong Road #B1-28, Kinex, Singapore 437157,"
"wv1y","JJ Japanese Cuisine (Kopitiam - Hougang One)","Japanese",4.9,429,"singapore","1 Hougang Street 91, #01-19 Hougang 1, Singapore,"
"tabw","Kopifellas (Alexandra Technopark)","",4.9,14,"singapore","Alexandra Technopark C, The Hub at ATP, Alexandra Rd 438C 438C Alexandra Road, #01-05/05A, 119976 Pasir Panjang, Outer Central, Singapore, Singapore,"
"v9ff","Penyet Town (Onekm)","Indonesian",5.0,4523,"singapore","11 Tanjong Katong Rd Onekm,"
"v1fz","Xin Wang Hong Kong Cafe (Nuh Medical Centre)","Chinese",4.9,878,"singapore","#02-10, 1 Lower Kent Ridge Road, Nuh Medical Centre, Bukit Timah, Buona Vista,"
"oizm","Botanict (Clementi Ave 2)","Vegetarian",5.0,27,"singapore","52 clememti ave 2 #01-123, S 120352,"
"axs3","Curry Paradise (Hougang Avenue 9)","Indian",4.8,32,"singapore","932 Hougang Avenue 9 SG532932,"
"qdzo","Brostern (Hougang Avenue 9)","Asian",4.8,6,"singapore","Hougang Ave 9 932, 532932 Hougang, North, Singapore, Singapore,"
"bov9","Good Combo Kitchen 好煮亿拉面小笼包 (Kinex)","Asian",0.0,0,"singapore","11 Tanjong Katong Road #01-60/61/62, Kinex, Singapore 437157,"
"kni2","S.Park Grill+Pasta (Ubi Avenue 4)","American",0.0,0,"singapore","152 Ubi Ave 4 Singapore, Singapore, S 408826,"
"zz4n","Makan Melaka (Haig Road)","Dessert",4.9,57,"singapore","12 Haig Rd, S 430012,"
"toja","MAGIC MIRCHI MASALA RESTAURANT (Clementi Street 12)","",4.8,23,"singapore","Block 106 Clementi Street 12 Unit number #01-62 Singapore 120106,"
"fdmv","恩 Live Seafood Restaurant (Psa Pass Centre) - Islandwide","",0.0,0,"singapore","7 Keppel Road, Tanjong Pagar Complex #01-01, No.7 Coffee House SG089053,"
"ybip","Bombay Garden - Indian Cuisine (Science Park)","",2.8,5,"singapore","7 SCIENCE PARK DRIVE #01-25,"
"go7i","Muscle Prep (KINEX)","Healthy",5.0,15,"singapore","KINEX, Tanjong Katong Rd 11 #B1-K22/23, 437157 Paya Lebar, East, Singapore, Singapore,"
"aifa","KOHINOOR-THE TASTE OF INDIA (Science Park) - Restaurant Delivery","Indian",0.0,0,"singapore","7 Science Park Dr, #01-01, Singapore 119316, S 119316,"
"l4up","Li Ji Coffee House (NUS)","Asian",4.9,254,"singapore","12 Science Drive 2 NUS Stall 3 Singapore 117549,"
"ujds","Poon Nah City Home Made Noodle (City Plaza)","Noodles",4.8,90,"singapore","#05-02, City Plaza, 810 Geylang Road,"
"lx9u","The Salad Crunch (Lower Kent Ridge)","",4.6,23,"singapore","1 Lower Kent Ridge Road Unit No: 01-37,"
"s6lr","Sk Cafe (City Plaza)","Pasta",4.7,1807,"singapore","810 Geylang road city Plaza #04-18/19 , Singapore 409286,"
"hwus","Ji Wei Ban Mian Fish Soup 吉味板面鱼汤 (Ubi Ave 3)","Singaporean",0.0,0,"singapore","50 Ubi Avenue 3, #01-03, Frontier, Singapore 408866,"
"w9g9","Hainanese Chicken Rice (703 Hougang)","Chicken",0.0,0,"singapore","703 Hougang Ave 2 #01-201 Singapore 530703,"
"prsb","Azuma Ryori (Kinex)","Japanese",4.8,339,"singapore","11 Tanjong Katong Road  #B1-K4, S 437157,"
"y8fe","Haig Road Cendol & Drinks (Haig Road)","Dessert",5.0,173,"singapore","14 Haig Road #01-27,"
"zicg","Kohinoor - The Taste of India (Science Park)","Indian",1.9,6,"singapore","7 Science Park Dr, #01-01, Singapore 119316,"
"w3ak","Haji Waliti Bin Haji Mazuki (Haig Road Market & Food Centre)","Noodles",5.0,1842,"singapore","01-18, 14 Haig Road, Haig Road Food Centre, Katong, East Coast,"
"kzqc","S.Saraswathy’s Kshathriya23 Saiva/Asaiva Food Casino (Clementi)","",0.0,0,"singapore","Blk.105 #03-18 (Lift C), Clementi St.12, Singapore -120 105.,"
"s3o0","Dapur Bakso (City Plaza)","Indonesian",4.9,6,"singapore","810 GEYLANG ROAD CITY PLAZA 01-28, Singapore, 409286, S 409286,"
"o7ad","Sinar Harapan (Haig Road)","Indonesian",4.8,70,"singapore","14 Haig Road #01-12, Haig Road Market & Food Centre, Singapore 430014,"
"s3es","Ci Yuan Authentic Hainanese Chicken Rice (Ci Yuan Hawker Centre)","Chicken Rice",4.9,2645,"singapore","51 Hougang Avenue 9,"
"f3ty","(pandago) Hajjah Jamillah Raj Mohamed Indian Muslim Food (Haig Road Market & Food Centre)","Noodles",5.0,153,"singapore","block 14, haig road, haig road food centre, #01-09, 430014,"
"eu7x","Dapur Penyet (City Plaza)","Indonesian",5.0,100,"singapore","City Plaza, 810 Geylang Road #01-43 SG409286, S 409286,"
"j5dg","219 THEFRIEDRICE (91 Telok Blangah)","",0.0,0,"singapore","91 TELOK BLANGAH STREET 31, #01-01 100091,"
"k1do","Ling Hui Seafood (Defu Lane)","Seafood",4.9,263,"singapore","4 Defu Lane 10,"
"oo32","Go2Eat (Hougang Avenue 4)","Western",4.9,719,"singapore","682 HOUGANG AVENUE 4, #01-346 HOUGANG VILLAGE, Singapore 530682,"
"x8to","Divine Realm Vegetarian Restaurant (Hougang Ave)","Vegetarian",5.0,2840,"singapore","501 Hougang Ave 8, #01-630,"
"nel4","Pasta Pizza (Haig Road)","Pizza",4.9,204,"singapore","12 Haig Road #01-323,"
"x3ba","Juiceland (Alexandra Retail Centre)","Beverages",4.9,87,"singapore","#01-13 Alexandra Retail Centre, 460 Alexandra Road,"
"x54p","Kang Kar Nang (Dairy Farm Mall)","Chicken",0.0,0,"singapore","4 Dairy Farm Lane,#01-12 Dairy Farm Mall,Singapore 677622, S 677622,"
"h6pa","My Genie Gourmet (Lorong 1 Realty Park)","Singaporean",5.0,210,"singapore","32 Lorong 1 Realty Park (Hougang), Singapore 536954,"
"fsuk","Bai Li Xiang Beehoon (Hougang Avenue 8)","Singaporean",4.8,40,"singapore","684 Hougang ave 8 #01-967,"
"agme","Happy House Mala Hotpot (Clementi354)","Chinese",4.9,288,"singapore","Blk354 Clementi Ave2 #01-157,"
"k36w","Monzen Izakaya and Grill (Dairy Farm Lane)","Japanese",4.9,8,"singapore","4 Dairy Farm Ln, #01-04, S 677622,"
"rpe4","Wonderful Cafe La Mian Xiao Long Bao Dim Sum (Nus)","Chinese",5.0,112,"singapore","1 Create Way, University Town NUS #01-04,"
"pcha","Mamak @ Al Sarah","Indian",4.7,12,"singapore","Tristar Complex, Geylang Rd 970 970 Geylang Road, #01-02. Pick-up @ Indian Food Stall., 423492 Katong, East, Singapore, Singapore,"
"s4ju","Pietro Ristorante Italiano (Jalan Kelulut)","Pizza",5.0,647,"singapore","12 Jalan Kelulut,"
"w6jw","Lakshmi Vilas Restaurant (Morse Road)","Indian",4.7,282,"singapore","16, MORSE ROAD, #01-203,"
"fkn8","Sajian Tradisi (Geylang Serai Market)","Indonesian",5.0,258,"singapore","1 GEYLANG SERAI #02-117,"
"y50e","KAIOHDON (460 Alexandra Rd)","Japanese",4.8,90,"singapore","119963,  Alexandra Retail Centre , 460 Alexandra Rd, #02-43A Singapore 119963, 119963 Pasir Panjang, Outer Central, Singapore, Singapore,"
"v75e","352 Roasted Delights 352 烧腊 (Clementi Avenue 2)","Asian",4.8,199,"singapore","352 Clementi Avenue 2 #01-153 (MeetUp @ 352 Coffeeshop), Singapore 120352,"
"v4ii","Ubi Dmq Eating House (Blk 304 Ubi)","Noodles",4.8,821,"singapore","#01-95, 304 Ubi Avenue 1, Ubi, Paya Lebar, Macpherson,"
"w1pu","Madeleine’S Original Portuguese Egg Tart (Tanjong Katong Road)","Cakes",5.0,482,"singapore","198 Tanjong Katong Road, Mountbatten, Fort Road,"
"nes5","Shahi Masala (Paya Lebar)","",0.0,0,"singapore","Haig Rd 26, 438735 Paya Lebar, East, Singapore, Singapore,"
"cbcg","Thai Empire (NUS UTown)","Thai",4.9,11,"singapore","Stall 2, 1 CREATE WAY, #01-04, NUS UTOWN, SINGAPORE 138602, S 138602,"
